A fact sheet with definitions and metadata for this dataset can be found at http://www.stateair.net/web/historical/1/1.html.,,,,,,,,,,
The U.S. Department of State Data Use Statement at http://www.stateair.net/web/historical/1/1.html applies to these and all data available from the Mission China air quality monitoring program.,,,,,,,,,,
,,,,,,,,,,
Site,Parameter,Date (LST),Year,Month,Day,Hour,Value,Unit,Duration,QC Name
Beijing,PM2.5,1/1/2016 0:00,2016,1,1,0,231,µg/m³,1 Hr,Valid
Beijing,PM2.5,1/1/2016 1:00,2016,1,1,1,239,µg/m³,1 Hr,Valid
Beijing,PM2.5,1/1/2016 2:00,2016,1,1,2,205,µg/m³,1 Hr,Valid
Beijing,PM2.5,1/1/2016 3:00,2016,1,1,3,167,µg/m³,1 Hr,Valid
Beijing,PM2.5,1/1/2016 4:00,2016,1,1,4,132,µg/m³,1 Hr,Valid
Beijing,PM2.5,1/1/2016 5:00,2016,1,1,5,169,µg/m³,1 Hr,Valid
Beijing,PM2.5,1/1/2016 6:00,2016,1,1,6,162,µg/m³,1 Hr,Valid
Beijing,PM2.5,1/1/2016 7:00,2016,1,1,7,123,µg/m³,1 Hr,Valid
Beijing,PM2.5,1/1/2016 8:00,2016,1,1,8,100,µg/m³,1 Hr,Valid
Beijing,PM2.5,1/1/2016 9:00,2016,1,1,9,101,µg/m³,1 Hr,Valid
Beijing,PM2.5,1/1/2016 10:00,2016,1,1,10,111,µg/m³,1 Hr,Valid
Beijing,PM2.5,1/1/2016 11:00,2016,1,1,11,115,µg/m³,1 Hr,Valid
Beijing,PM2.5,1/1/2016 12:00,2016,1,1,12,135,µg/m³,1 Hr,Valid
Beijing,PM2.5,1/1/2016 13:00,2016,1,1,13,165,µg/m³,1 Hr,Valid
Beijing,PM2.5,1/1/2016 14:00,2016,1,1,14,176,µg/m³,1 Hr,Valid
Beijing,PM2.5,1/1/2016 15:00,2016,1,1,15,187,µg/m³,1 Hr,Valid
Beijing,PM2.5,1/1/2016 16:00,2016,1,1,16,207,µg/m³,1 Hr,Valid
Beijing,PM2.5,1/1/2016 17:00,2016,1,1,17,235,µg/m³,1 Hr,Valid
Beijing,PM2.5,1/1/2016 18:00,2016,1,1,18,268,µg/m³,1 Hr,Valid
Beijing,PM2.5,1/1/2016 19:00,2016,1,1,19,302,µg/m³,1 Hr,Valid
Beijing,PM2.5,1/1/2016 20:00,2016,1,1,20,330,µg/m³,1 Hr,Valid
Beijing,PM2.5,1/1/2016 21:00,2016,1,1,21,345,µg/m³,1 Hr,Valid
Beijing,PM2.5,1/1/2016 22:00,2016,1,1,22,375,µg/m³,1 Hr,Valid
Beijing,PM2.5,1/1/2016 23:00,2016,1,1,23,400,µg/m³,1 Hr,Valid
Beijing,PM2.5,1/2/2016 0:00,2016,1,2,0,362,µg/m³,1 Hr,Valid
Beijing,PM2.5,1/2/2016 1:00,2016,1,2,1,321,µg/m³,1 Hr,Valid
Beijing,PM2.5,1/2/2016 2:00,2016,1,2,2,230,µg/m³,1 Hr,Valid
Beijing,PM2.5,1/2/2016 3:00,2016,1,2,3,225,µg/m³,1 Hr,Valid
Beijing,PM2.5,1/2/2016 4:00,2016,1,2,4,198,µg/m³,1 Hr,Valid
Beijing,PM2.5,1/2/2016 5:00,2016,1,2,5,191,µg/m³,1 Hr,Valid
Beijing,PM2.5,1/2/2016 6:00,2016,1,2,6,199,µg/m³,1 Hr,Valid
Beijing,PM2.5,1/2/2016 7:00,2016,1,2,7,206,µg/m³,1 Hr,Valid
Beijing,PM2.5,1/2/2016 8:00,2016,1,2,8,230,µg/m³,1 Hr,Valid
Beijing,PM2.5,1/2/2016 9:00,2016,1,2,9,279,µg/m³,1 Hr,Valid
Beijing,PM2.5,1/2/2016 10:00,2016,1,2,10,199,µg/m³,1 Hr,Valid
Beijing,PM2.5,1/2/2016 11:00,2016,1,2,11,220,µg/m³,1 Hr,Valid
Beijing,PM2.5,1/2/2016 12:00,2016,1,2,12,222,µg/m³,1 Hr,Valid
Beijing,PM2.5,1/2/2016 13:00,2016,1,2,13,220,µg/m³,1 Hr,Valid
Beijing,PM2.5,1/2/2016 14:00,2016,1,2,14,198,µg/m³,1 Hr,Valid
Beijing,PM2.5,1/2/2016 15:00,2016,1,2,15,208,µg/m³,1 Hr,Valid
Beijing,PM2.5,1/2/2016 16:00,2016,1,2,16,240,µg/m³,1 Hr,Valid
Beijing,PM2.5,1/2/2016 17:00,2016,1,2,17,293,µg/m³,1 Hr,Valid
Beijing,PM2.5,1/2/2016 18:00,2016,1,2,18,368,µg/m³,1 Hr,Valid
Beijing,PM2.5,1/2/2016 19:00,2016,1,2,19,493,µg/m³,1 Hr,Valid
Beijing,PM2.5,1/2/2016 20:00,2016,1,2,20,517,µg/m³,1 Hr,Valid
Beijing,PM2.5,1/2/2016 21:00,2016,1,2,21,501,µg/m³,1 Hr,Valid
Beijing,PM2.5,1/2/2016 22:00,2016,1,2,22,496,µg/m³,1 Hr,Valid
Beijing,PM2.5,1/2/2016 23:00,2016,1,2,23,559,µg/m³,1 Hr,Valid
Beijing,PM2.5,1/3/2016 0:00,2016,1,3,0,530,µg/m³,1 Hr,Valid
Beijing,PM2.5,1/3/2016 1:00,2016,1,3,1,582,µg/m³,1 Hr,Valid
Beijing,PM2.5,1/3/2016 2:00,2016,1,3,2,406,µg/m³,1 Hr,Valid
Beijing,PM2.5,1/3/2016 3:00,2016,1,3,3,261,µg/m³,1 Hr,Valid
Beijing,PM2.5,1/3/2016 4:00,2016,1,3,4,244,µg/m³,1 Hr,Valid
Beijing,PM2.5,1/3/2016 5:00,2016,1,3,5,229,µg/m³,1 Hr,Valid
Beijing,PM2.5,1/3/2016 6:00,2016,1,3,6,176,µg/m³,1 Hr,Valid
Beijing,PM2.5,1/3/2016 7:00,2016,1,3,7,178,µg/m³,1 Hr,Valid
Beijing,PM2.5,1/3/2016 8:00,2016,1,3,8,166,µg/m³,1 Hr,Valid
Beijing,PM2.5,1/3/2016 9:00,2016,1,3,9,131,µg/m³,1 Hr,Valid
Beijing,PM2.5,1/3/2016 10:00,2016,1,3,10,131,µg/m³,1 Hr,Valid
Beijing,PM2.5,1/3/2016 11:00,2016,1,3,11,107,µg/m³,1 Hr,Valid
Beijing,PM2.5,1/3/2016 12:00,2016,1,3,12,103,µg/m³,1 Hr,Valid
Beijing,PM2.5,1/3/2016 13:00,2016,1,3,13,100,µg/m³,1 Hr,Valid
Beijing,PM2.5,1/3/2016 14:00,2016,1,3,14,107,µg/m³,1 Hr,Valid
Beijing,PM2.5,1/3/2016 15:00,2016,1,3,15,115,µg/m³,1 Hr,Valid
Beijing,PM2.5,1/3/2016 16:00,2016,1,3,16,157,µg/m³,1 Hr,Valid
Beijing,PM2.5,1/3/2016 17:00,2016,1,3,17,208,µg/m³,1 Hr,Valid
Beijing,PM2.5,1/3/2016 18:00,2016,1,3,18,214,µg/m³,1 Hr,Valid
Beijing,PM2.5,1/3/2016 19:00,2016,1,3,19,217,µg/m³,1 Hr,Valid
Beijing,PM2.5,1/3/2016 20:00,2016,1,3,20,217,µg/m³,1 Hr,Valid
Beijing,PM2.5,1/3/2016 21:00,2016,1,3,21,229,µg/m³,1 Hr,Valid
Beijing,PM2.5,1/3/2016 22:00,2016,1,3,22,239,µg/m³,1 Hr,Valid
Beijing,PM2.5,1/3/2016 23:00,2016,1,3,23,243,µg/m³,1 Hr,Valid
Beijing,PM2.5,1/4/2016 0:00,2016,1,4,0,251,µg/m³,1 Hr,Valid
Beijing,PM2.5,1/4/2016 1:00,2016,1,4,1,231,µg/m³,1 Hr,Valid
Beijing,PM2.5,1/4/2016 2:00,2016,1,4,2,70,µg/m³,1 Hr,Valid
Beijing,PM2.5,1/4/2016 3:00,2016,1,4,3,11,µg/m³,1 Hr,Valid
Beijing,PM2.5,1/4/2016 4:00,2016,1,4,4,7,µg/m³,1 Hr,Valid
Beijing,PM2.5,1/4/2016 5:00,2016,1,4,5,8,µg/m³,1 Hr,Valid
Beijing,PM2.5,1/4/2016 6:00,2016,1,4,6,9,µg/m³,1 Hr,Valid
Beijing,PM2.5,1/4/2016 7:00,2016,1,4,7,10,µg/m³,1 Hr,Valid
Beijing,PM2.5,1/4/2016 8:00,2016,1,4,8,6,µg/m³,1 Hr,Valid
Beijing,PM2.5,1/4/2016 9:00,2016,1,4,9,12,µg/m³,1 Hr,Valid
Beijing,PM2.5,1/4/2016 10:00,2016,1,4,10,13,µg/m³,1 Hr,Valid
Beijing,PM2.5,1/4/2016 11:00,2016,1,4,11,12,µg/m³,1 Hr,Valid
Beijing,PM2.5,1/4/2016 12:00,2016,1,4,12,15,µg/m³,1 Hr,Valid
Beijing,PM2.5,1/4/2016 13:00,2016,1,4,13,10,µg/m³,1 Hr,Valid
Beijing,PM2.5,1/4/2016 14:00,2016,1,4,14,16,µg/m³,1 Hr,Valid
Beijing,PM2.5,1/4/2016 15:00,2016,1,4,15,14,µg/m³,1 Hr,Valid
Beijing,PM2.5,1/4/2016 16:00,2016,1,4,16,16,µg/m³,1 Hr,Valid
Beijing,PM2.5,1/4/2016 17:00,2016,1,4,17,11,µg/m³,1 Hr,Valid
Beijing,PM2.5,1/4/2016 18:00,2016,1,4,18,16,µg/m³,1 Hr,Valid
Beijing,PM2.5,1/4/2016 19:00,2016,1,4,19,14,µg/m³,1 Hr,Valid
Beijing,PM2.5,1/4/2016 20:00,2016,1,4,20,11,µg/m³,1 Hr,Valid
Beijing,PM2.5,1/4/2016 21:00,2016,1,4,21,11,µg/m³,1 Hr,Valid
Beijing,PM2.5,1/4/2016 22:00,2016,1,4,22,12,µg/m³,1 Hr,Valid
Beijing,PM2.5,1/4/2016 23:00,2016,1,4,23,9,µg/m³,1 Hr,Valid
Beijing,PM2.5,1/5/2016 0:00,2016,1,5,0,9,µg/m³,1 Hr,Valid
Beijing,PM2.5,1/5/2016 1:00,2016,1,5,1,9,µg/m³,1 Hr,Valid
Beijing,PM2.5,1/5/2016 2:00,2016,1,5,2,7,µg/m³,1 Hr,Valid
Beijing,PM2.5,1/5/2016 3:00,2016,1,5,3,7,µg/m³,1 Hr,Valid
Beijing,PM2.5,1/5/2016 4:00,2016,1,5,4,8,µg/m³,1 Hr,Valid
Beijing,PM2.5,1/5/2016 5:00,2016,1,5,5,9,µg/m³,1 Hr,Valid
Beijing,PM2.5,1/5/2016 6:00,2016,1,5,6,9,µg/m³,1 Hr,Valid
Beijing,PM2.5,1/5/2016 7:00,2016,1,5,7,14,µg/m³,1 Hr,Valid
Beijing,PM2.5,1/5/2016 8:00,2016,1,5,8,11,µg/m³,1 Hr,Valid
Beijing,PM2.5,1/5/2016 9:00,2016,1,5,9,13,µg/m³,1 Hr,Valid
Beijing,PM2.5,1/5/2016 10:00,2016,1,5,10,12,µg/m³,1 Hr,Valid
Beijing,PM2.5,1/5/2016 11:00,2016,1,5,11,12,µg/m³,1 Hr,Valid
Beijing,PM2.5,1/5/2016 12:00,2016,1,5,12,14,µg/m³,1 Hr,Valid
Beijing,PM2.5,1/5/2016 13:00,2016,1,5,13,12,µg/m³,1 Hr,Valid
Beijing,PM2.5,1/5/2016 14:00,2016,1,5,14,15,µg/m³,1 Hr,Valid
Beijing,PM2.5,1/5/2016 15:00,2016,1,5,15,33,µg/m³,1 Hr,Valid
Beijing,PM2.5,1/5/2016 16:00,2016,1,5,16,45,µg/m³,1 Hr,Valid
Beijing,PM2.5,1/5/2016 17:00,2016,1,5,17,54,µg/m³,1 Hr,Valid
Beijing,PM2.5,1/5/2016 18:00,2016,1,5,18,72,µg/m³,1 Hr,Valid
Beijing,PM2.5,1/5/2016 19:00,2016,1,5,19,86,µg/m³,1 Hr,Valid
Beijing,PM2.5,1/5/2016 20:00,2016,1,5,20,91,µg/m³,1 Hr,Valid
Beijing,PM2.5,1/5/2016 21:00,2016,1,5,21,101,µg/m³,1 Hr,Valid
Beijing,PM2.5,1/5/2016 22:00,2016,1,5,22,76,µg/m³,1 Hr,Valid
Beijing,PM2.5,1/5/2016 23:00,2016,1,5,23,55,µg/m³,1 Hr,Valid
Beijing,PM2.5,1/6/2016 0:00,2016,1,6,0,97,µg/m³,1 Hr,Valid
Beijing,PM2.5,1/6/2016 1:00,2016,1,6,1,47,µg/m³,1 Hr,Valid
Beijing,PM2.5,1/6/2016 2:00,2016,1,6,2,30,µg/m³,1 Hr,Valid
Beijing,PM2.5,1/6/2016 3:00,2016,1,6,3,37,µg/m³,1 Hr,Valid
Beijing,PM2.5,1/6/2016 4:00,2016,1,6,4,42,µg/m³,1 Hr,Valid
Beijing,PM2.5,1/6/2016 5:00,2016,1,6,5,28,µg/m³,1 Hr,Valid
Beijing,PM2.5,1/6/2016 6:00,2016,1,6,6,17,µg/m³,1 Hr,Valid
Beijing,PM2.5,1/6/2016 7:00,2016,1,6,7,27,µg/m³,1 Hr,Valid
Beijing,PM2.5,1/6/2016 8:00,2016,1,6,8,30,µg/m³,1 Hr,Valid
Beijing,PM2.5,1/6/2016 9:00,2016,1,6,9,40,µg/m³,1 Hr,Valid
Beijing,PM2.5,1/6/2016 10:00,2016,1,6,10,19,µg/m³,1 Hr,Valid
Beijing,PM2.5,1/6/2016 11:00,2016,1,6,11,16,µg/m³,1 Hr,Valid
Beijing,PM2.5,1/6/2016 12:00,2016,1,6,12,7,µg/m³,1 Hr,Valid
Beijing,PM2.5,1/6/2016 13:00,2016,1,6,13,11,µg/m³,1 Hr,Valid
Beijing,PM2.5,1/6/2016 14:00,2016,1,6,14,10,µg/m³,1 Hr,Valid
Beijing,PM2.5,1/6/2016 15:00,2016,1,6,15,10,µg/m³,1 Hr,Valid
Beijing,PM2.5,1/6/2016 16:00,2016,1,6,16,9,µg/m³,1 Hr,Valid
Beijing,PM2.5,1/6/2016 17:00,2016,1,6,17,7,µg/m³,1 Hr,Valid
Beijing,PM2.5,1/6/2016 18:00,2016,1,6,18,11,µg/m³,1 Hr,Valid
Beijing,PM2.5,1/6/2016 19:00,2016,1,6,19,11,µg/m³,1 Hr,Valid
Beijing,PM2.5,1/6/2016 20:00,2016,1,6,20,11,µg/m³,1 Hr,Valid
Beijing,PM2.5,1/6/2016 21:00,2016,1,6,21,9,µg/m³,1 Hr,Valid
Beijing,PM2.5,1/6/2016 22:00,2016,1,6,22,7,µg/m³,1 Hr,Valid
Beijing,PM2.5,1/6/2016 23:00,2016,1,6,23,12,µg/m³,1 Hr,Valid
Beijing,PM2.5,1/7/2016 0:00,2016,1,7,0,12,µg/m³,1 Hr,Valid
Beijing,PM2.5,1/7/2016 1:00,2016,1,7,1,8,µg/m³,1 Hr,Valid
Beijing,PM2.5,1/7/2016 2:00,2016,1,7,2,8,µg/m³,1 Hr,Valid
Beijing,PM2.5,1/7/2016 3:00,2016,1,7,3,10,µg/m³,1 Hr,Valid
Beijing,PM2.5,1/7/2016 4:00,2016,1,7,4,8,µg/m³,1 Hr,Valid
Beijing,PM2.5,1/7/2016 5:00,2016,1,7,5,7,µg/m³,1 Hr,Valid
Beijing,PM2.5,1/7/2016 6:00,2016,1,7,6,8,µg/m³,1 Hr,Valid
Beijing,PM2.5,1/7/2016 7:00,2016,1,7,7,9,µg/m³,1 Hr,Valid
Beijing,PM2.5,1/7/2016 8:00,2016,1,7,8,9,µg/m³,1 Hr,Valid
Beijing,PM2.5,1/7/2016 9:00,2016,1,7,9,11,µg/m³,1 Hr,Valid
Beijing,PM2.5,1/7/2016 10:00,2016,1,7,10,12,µg/m³,1 Hr,Valid
Beijing,PM2.5,1/7/2016 11:00,2016,1,7,11,7,µg/m³,1 Hr,Valid
Beijing,PM2.5,1/7/2016 12:00,2016,1,7,12,6,µg/m³,1 Hr,Valid
Beijing,PM2.5,1/7/2016 13:00,2016,1,7,13,9,µg/m³,1 Hr,Valid
Beijing,PM2.5,1/7/2016 14:00,2016,1,7,14,7,µg/m³,1 Hr,Valid
Beijing,PM2.5,1/7/2016 15:00,2016,1,7,15,10,µg/m³,1 Hr,Valid
Beijing,PM2.5,1/7/2016 16:00,2016,1,7,16,11,µg/m³,1 Hr,Valid
Beijing,PM2.5,1/7/2016 17:00,2016,1,7,17,14,µg/m³,1 Hr,Valid
Beijing,PM2.5,1/7/2016 18:00,2016,1,7,18,16,µg/m³,1 Hr,Valid
Beijing,PM2.5,1/7/2016 19:00,2016,1,7,19,13,µg/m³,1 Hr,Valid
Beijing,PM2.5,1/7/2016 20:00,2016,1,7,20,18,µg/m³,1 Hr,Valid
Beijing,PM2.5,1/7/2016 21:00,2016,1,7,21,12,µg/m³,1 Hr,Valid
Beijing,PM2.5,1/7/2016 22:00,2016,1,7,22,18,µg/m³,1 Hr,Valid
Beijing,PM2.5,1/7/2016 23:00,2016,1,7,23,16,µg/m³,1 Hr,Valid
Beijing,PM2.5,1/8/2016 0:00,2016,1,8,0,17,µg/m³,1 Hr,Valid
Beijing,PM2.5,1/8/2016 1:00,2016,1,8,1,14,µg/m³,1 Hr,Valid
Beijing,PM2.5,1/8/2016 2:00,2016,1,8,2,14,µg/m³,1 Hr,Valid
Beijing,PM2.5,1/8/2016 3:00,2016,1,8,3,9,µg/m³,1 Hr,Valid
Beijing,PM2.5,1/8/2016 4:00,2016,1,8,4,7,µg/m³,1 Hr,Valid
Beijing,PM2.5,1/8/2016 5:00,2016,1,8,5,6,µg/m³,1 Hr,Valid
Beijing,PM2.5,1/8/2016 6:00,2016,1,8,6,9,µg/m³,1 Hr,Valid
Beijing,PM2.5,1/8/2016 7:00,2016,1,8,7,16,µg/m³,1 Hr,Valid
Beijing,PM2.5,1/8/2016 8:00,2016,1,8,8,16,µg/m³,1 Hr,Valid
Beijing,PM2.5,1/8/2016 9:00,2016,1,8,9,21,µg/m³,1 Hr,Valid
Beijing,PM2.5,1/8/2016 10:00,2016,1,8,10,19,µg/m³,1 Hr,Valid
Beijing,PM2.5,1/8/2016 11:00,2016,1,8,11,15,µg/m³,1 Hr,Valid
Beijing,PM2.5,1/8/2016 12:00,2016,1,8,12,22,µg/m³,1 Hr,Valid
Beijing,PM2.5,1/8/2016 13:00,2016,1,8,13,17,µg/m³,1 Hr,Valid
Beijing,PM2.5,1/8/2016 14:00,2016,1,8,14,13,µg/m³,1 Hr,Valid
Beijing,PM2.5,1/8/2016 15:00,2016,1,8,15,10,µg/m³,1 Hr,Valid
Beijing,PM2.5,1/8/2016 16:00,2016,1,8,16,9,µg/m³,1 Hr,Valid
Beijing,PM2.5,1/8/2016 17:00,2016,1,8,17,18,µg/m³,1 Hr,Valid
Beijing,PM2.5,1/8/2016 18:00,2016,1,8,18,61,µg/m³,1 Hr,Valid
Beijing,PM2.5,1/8/2016 19:00,2016,1,8,19,99,µg/m³,1 Hr,Valid
Beijing,PM2.5,1/8/2016 20:00,2016,1,8,20,124,µg/m³,1 Hr,Valid
Beijing,PM2.5,1/8/2016 21:00,2016,1,8,21,135,µg/m³,1 Hr,Valid
Beijing,PM2.5,1/8/2016 22:00,2016,1,8,22,137,µg/m³,1 Hr,Valid
Beijing,PM2.5,1/8/2016 23:00,2016,1,8,23,138,µg/m³,1 Hr,Valid
Beijing,PM2.5,1/9/2016 0:00,2016,1,9,0,136,µg/m³,1 Hr,Valid
Beijing,PM2.5,1/9/2016 1:00,2016,1,9,1,124,µg/m³,1 Hr,Valid
Beijing,PM2.5,1/9/2016 2:00,2016,1,9,2,85,µg/m³,1 Hr,Valid
Beijing,PM2.5,1/9/2016 3:00,2016,1,9,3,82,µg/m³,1 Hr,Valid
Beijing,PM2.5,1/9/2016 4:00,2016,1,9,4,74,µg/m³,1 Hr,Valid
Beijing,PM2.5,1/9/2016 5:00,2016,1,9,5,48,µg/m³,1 Hr,Valid
Beijing,PM2.5,1/9/2016 6:00,2016,1,9,6,33,µg/m³,1 Hr,Valid
Beijing,PM2.5,1/9/2016 7:00,2016,1,9,7,28,µg/m³,1 Hr,Valid
Beijing,PM2.5,1/9/2016 8:00,2016,1,9,8,28,µg/m³,1 Hr,Valid
Beijing,PM2.5,1/9/2016 9:00,2016,1,9,9,25,µg/m³,1 Hr,Valid
Beijing,PM2.5,1/9/2016 10:00,2016,1,9,10,29,µg/m³,1 Hr,Valid
Beijing,PM2.5,1/9/2016 11:00,2016,1,9,11,31,µg/m³,1 Hr,Valid
Beijing,PM2.5,1/9/2016 12:00,2016,1,9,12,37,µg/m³,1 Hr,Valid
Beijing,PM2.5,1/9/2016 13:00,2016,1,9,13,44,µg/m³,1 Hr,Valid
Beijing,PM2.5,1/9/2016 14:00,2016,1,9,14,44,µg/m³,1 Hr,Valid
Beijing,PM2.5,1/9/2016 15:00,2016,1,9,15,32,µg/m³,1 Hr,Valid
Beijing,PM2.5,1/9/2016 16:00,2016,1,9,16,48,µg/m³,1 Hr,Valid
Beijing,PM2.5,1/9/2016 17:00,2016,1,9,17,57,µg/m³,1 Hr,Valid
Beijing,PM2.5,1/9/2016 18:00,2016,1,9,18,87,µg/m³,1 Hr,Valid
Beijing,PM2.5,1/9/2016 19:00,2016,1,9,19,102,µg/m³,1 Hr,Valid
Beijing,PM2.5,1/9/2016 20:00,2016,1,9,20,144,µg/m³,1 Hr,Valid
Beijing,PM2.5,1/9/2016 21:00,2016,1,9,21,173,µg/m³,1 Hr,Valid
Beijing,PM2.5,1/9/2016 22:00,2016,1,9,22,164,µg/m³,1 Hr,Valid
Beijing,PM2.5,1/9/2016 23:00,2016,1,9,23,124,µg/m³,1 Hr,Valid
Beijing,PM2.5,1/10/2016 0:00,2016,1,10,0,83,µg/m³,1 Hr,Valid
Beijing,PM2.5,1/10/2016 1:00,2016,1,10,1,70,µg/m³,1 Hr,Valid
Beijing,PM2.5,1/10/2016 2:00,2016,1,10,2,61,µg/m³,1 Hr,Valid
Beijing,PM2.5,1/10/2016 3:00,2016,1,10,3,44,µg/m³,1 Hr,Valid
Beijing,PM2.5,1/10/2016 4:00,2016,1,10,4,28,µg/m³,1 Hr,Valid
Beijing,PM2.5,1/10/2016 5:00,2016,1,10,5,25,µg/m³,1 Hr,Valid
Beijing,PM2.5,1/10/2016 6:00,2016,1,10,6,26,µg/m³,1 Hr,Valid
Beijing,PM2.5,1/10/2016 7:00,2016,1,10,7,25,µg/m³,1 Hr,Valid
Beijing,PM2.5,1/10/2016 8:00,2016,1,10,8,16,µg/m³,1 Hr,Valid
Beijing,PM2.5,1/10/2016 9:00,2016,1,10,9,24,µg/m³,1 Hr,Valid
Beijing,PM2.5,1/10/2016 10:00,2016,1,10,10,39,µg/m³,1 Hr,Valid
Beijing,PM2.5,1/10/2016 11:00,2016,1,10,11,43,µg/m³,1 Hr,Valid
Beijing,PM2.5,1/10/2016 12:00,2016,1,10,12,55,µg/m³,1 Hr,Valid
Beijing,PM2.5,1/10/2016 13:00,2016,1,10,13,63,µg/m³,1 Hr,Valid
Beijing,PM2.5,1/10/2016 14:00,2016,1,10,14,50,µg/m³,1 Hr,Valid
Beijing,PM2.5,1/10/2016 15:00,2016,1,10,15,74,µg/m³,1 Hr,Valid
Beijing,PM2.5,1/10/2016 16:00,2016,1,10,16,69,µg/m³,1 Hr,Valid
Beijing,PM2.5,1/10/2016 17:00,2016,1,10,17,67,µg/m³,1 Hr,Valid
Beijing,PM2.5,1/10/2016 18:00,2016,1,10,18,68,µg/m³,1 Hr,Valid
Beijing,PM2.5,1/10/2016 19:00,2016,1,10,19,69,µg/m³,1 Hr,Valid
Beijing,PM2.5,1/10/2016 20:00,2016,1,10,20,76,µg/m³,1 Hr,Valid
Beijing,PM2.5,1/10/2016 21:00,2016,1,10,21,29,µg/m³,1 Hr,Valid
Beijing,PM2.5,1/10/2016 22:00,2016,1,10,22,20,µg/m³,1 Hr,Valid
Beijing,PM2.5,1/10/2016 23:00,2016,1,10,23,16,µg/m³,1 Hr,Valid
Beijing,PM2.5,1/11/2016 0:00,2016,1,11,0,15,µg/m³,1 Hr,Valid
Beijing,PM2.5,1/11/2016 1:00,2016,1,11,1,17,µg/m³,1 Hr,Valid
Beijing,PM2.5,1/11/2016 2:00,2016,1,11,2,9,µg/m³,1 Hr,Valid
Beijing,PM2.5,1/11/2016 3:00,2016,1,11,3,9,µg/m³,1 Hr,Valid
Beijing,PM2.5,1/11/2016 4:00,2016,1,11,4,11,µg/m³,1 Hr,Valid
Beijing,PM2.5,1/11/2016 5:00,2016,1,11,5,10,µg/m³,1 Hr,Valid
Beijing,PM2.5,1/11/2016 6:00,2016,1,11,6,10,µg/m³,1 Hr,Valid
Beijing,PM2.5,1/11/2016 7:00,2016,1,11,7,12,µg/m³,1 Hr,Valid
Beijing,PM2.5,1/11/2016 8:00,2016,1,11,8,13,µg/m³,1 Hr,Valid
Beijing,PM2.5,1/11/2016 9:00,2016,1,11,9,13,µg/m³,1 Hr,Valid
Beijing,PM2.5,1/11/2016 10:00,2016,1,11,10,11,µg/m³,1 Hr,Valid
Beijing,PM2.5,1/11/2016 11:00,2016,1,11,11,14,µg/m³,1 Hr,Valid
Beijing,PM2.5,1/11/2016 12:00,2016,1,11,12,10,µg/m³,1 Hr,Valid
Beijing,PM2.5,1/11/2016 13:00,2016,1,11,13,9,µg/m³,1 Hr,Valid
Beijing,PM2.5,1/11/2016 14:00,2016,1,11,14,8,µg/m³,1 Hr,Valid
Beijing,PM2.5,1/11/2016 15:00,2016,1,11,15,10,µg/m³,1 Hr,Valid
Beijing,PM2.5,1/11/2016 16:00,2016,1,11,16,9,µg/m³,1 Hr,Valid
Beijing,PM2.5,1/11/2016 17:00,2016,1,11,17,12,µg/m³,1 Hr,Valid
Beijing,PM2.5,1/11/2016 18:00,2016,1,11,18,8,µg/m³,1 Hr,Valid
Beijing,PM2.5,1/11/2016 19:00,2016,1,11,19,12,µg/m³,1 Hr,Valid
Beijing,PM2.5,1/11/2016 20:00,2016,1,11,20,18,µg/m³,1 Hr,Valid
Beijing,PM2.5,1/11/2016 21:00,2016,1,11,21,12,µg/m³,1 Hr,Valid
Beijing,PM2.5,1/11/2016 22:00,2016,1,11,22,17,µg/m³,1 Hr,Valid
Beijing,PM2.5,1/11/2016 23:00,2016,1,11,23,15,µg/m³,1 Hr,Valid
Beijing,PM2.5,1/12/2016 0:00,2016,1,12,0,14,µg/m³,1 Hr,Valid
Beijing,PM2.5,1/12/2016 1:00,2016,1,12,1,15,µg/m³,1 Hr,Valid
Beijing,PM2.5,1/12/2016 2:00,2016,1,12,2,13,µg/m³,1 Hr,Valid
Beijing,PM2.5,1/12/2016 3:00,2016,1,12,3,11,µg/m³,1 Hr,Valid
Beijing,PM2.5,1/12/2016 4:00,2016,1,12,4,8,µg/m³,1 Hr,Valid
Beijing,PM2.5,1/12/2016 5:00,2016,1,12,5,9,µg/m³,1 Hr,Valid
Beijing,PM2.5,1/12/2016 6:00,2016,1,12,6,14,µg/m³,1 Hr,Valid
Beijing,PM2.5,1/12/2016 7:00,2016,1,12,7,19,µg/m³,1 Hr,Valid
Beijing,PM2.5,1/12/2016 8:00,2016,1,12,8,24,µg/m³,1 Hr,Valid
Beijing,PM2.5,1/12/2016 9:00,2016,1,12,9,30,µg/m³,1 Hr,Valid
Beijing,PM2.5,1/12/2016 10:00,2016,1,12,10,15,µg/m³,1 Hr,Valid
Beijing,PM2.5,1/12/2016 11:00,2016,1,12,11,9,µg/m³,1 Hr,Valid
Beijing,PM2.5,1/12/2016 12:00,2016,1,12,12,9,µg/m³,1 Hr,Valid
Beijing,PM2.5,1/12/2016 13:00,2016,1,12,13,8,µg/m³,1 Hr,Valid
Beijing,PM2.5,1/12/2016 14:00,2016,1,12,14,10,µg/m³,1 Hr,Valid
Beijing,PM2.5,1/12/2016 15:00,2016,1,12,15,8,µg/m³,1 Hr,Valid
Beijing,PM2.5,1/12/2016 16:00,2016,1,12,16,6,µg/m³,1 Hr,Valid
Beijing,PM2.5,1/12/2016 17:00,2016,1,12,17,5,µg/m³,1 Hr,Valid
Beijing,PM2.5,1/12/2016 18:00,2016,1,12,18,12,µg/m³,1 Hr,Valid
Beijing,PM2.5,1/12/2016 19:00,2016,1,12,19,14,µg/m³,1 Hr,Valid
Beijing,PM2.5,1/12/2016 20:00,2016,1,12,20,21,µg/m³,1 Hr,Valid
Beijing,PM2.5,1/12/2016 21:00,2016,1,12,21,15,µg/m³,1 Hr,Valid
Beijing,PM2.5,1/12/2016 22:00,2016,1,12,22,14,µg/m³,1 Hr,Valid
Beijing,PM2.5,1/12/2016 23:00,2016,1,12,23,12,µg/m³,1 Hr,Valid
Beijing,PM2.5,1/13/2016 0:00,2016,1,13,0,12,µg/m³,1 Hr,Valid
Beijing,PM2.5,1/13/2016 1:00,2016,1,13,1,10,µg/m³,1 Hr,Valid
Beijing,PM2.5,1/13/2016 2:00,2016,1,13,2,8,µg/m³,1 Hr,Valid
Beijing,PM2.5,1/13/2016 3:00,2016,1,13,3,7,µg/m³,1 Hr,Valid
Beijing,PM2.5,1/13/2016 4:00,2016,1,13,4,7,µg/m³,1 Hr,Valid
Beijing,PM2.5,1/13/2016 5:00,2016,1,13,5,6,µg/m³,1 Hr,Valid
Beijing,PM2.5,1/13/2016 6:00,2016,1,13,6,12,µg/m³,1 Hr,Valid
Beijing,PM2.5,1/13/2016 7:00,2016,1,13,7,16,µg/m³,1 Hr,Valid
Beijing,PM2.5,1/13/2016 8:00,2016,1,13,8,24,µg/m³,1 Hr,Valid
Beijing,PM2.5,1/13/2016 9:00,2016,1,13,9,20,µg/m³,1 Hr,Valid
Beijing,PM2.5,1/13/2016 10:00,2016,1,13,10,23,µg/m³,1 Hr,Valid
Beijing,PM2.5,1/13/2016 11:00,2016,1,13,11,23,µg/m³,1 Hr,Valid
Beijing,PM2.5,1/13/2016 12:00,2016,1,13,12,15,µg/m³,1 Hr,Valid
Beijing,PM2.5,1/13/2016 13:00,2016,1,13,13,13,µg/m³,1 Hr,Valid
Beijing,PM2.5,1/13/2016 14:00,2016,1,13,14,15,µg/m³,1 Hr,Valid
Beijing,PM2.5,1/13/2016 15:00,2016,1,13,15,11,µg/m³,1 Hr,Valid
Beijing,PM2.5,1/13/2016 16:00,2016,1,13,16,18,µg/m³,1 Hr,Valid
Beijing,PM2.5,1/13/2016 17:00,2016,1,13,17,19,µg/m³,1 Hr,Valid
Beijing,PM2.5,1/13/2016 18:00,2016,1,13,18,29,µg/m³,1 Hr,Valid
Beijing,PM2.5,1/13/2016 19:00,2016,1,13,19,35,µg/m³,1 Hr,Valid
Beijing,PM2.5,1/13/2016 20:00,2016,1,13,20,36,µg/m³,1 Hr,Valid
Beijing,PM2.5,1/13/2016 21:00,2016,1,13,21,45,µg/m³,1 Hr,Valid
Beijing,PM2.5,1/13/2016 22:00,2016,1,13,22,48,µg/m³,1 Hr,Valid
Beijing,PM2.5,1/13/2016 23:00,2016,1,13,23,51,µg/m³,1 Hr,Valid
Beijing,PM2.5,1/14/2016 0:00,2016,1,14,0,44,µg/m³,1 Hr,Valid
Beijing,PM2.5,1/14/2016 1:00,2016,1,14,1,39,µg/m³,1 Hr,Valid
Beijing,PM2.5,1/14/2016 2:00,2016,1,14,2,38,µg/m³,1 Hr,Valid
Beijing,PM2.5,1/14/2016 3:00,2016,1,14,3,47,µg/m³,1 Hr,Valid
Beijing,PM2.5,1/14/2016 4:00,2016,1,14,4,41,µg/m³,1 Hr,Valid
Beijing,PM2.5,1/14/2016 5:00,2016,1,14,5,40,µg/m³,1 Hr,Valid
Beijing,PM2.5,1/14/2016 6:00,2016,1,14,6,32,µg/m³,1 Hr,Valid
Beijing,PM2.5,1/14/2016 7:00,2016,1,14,7,47,µg/m³,1 Hr,Valid
Beijing,PM2.5,1/14/2016 8:00,2016,1,14,8,78,µg/m³,1 Hr,Valid
Beijing,PM2.5,1/14/2016 9:00,2016,1,14,9,111,µg/m³,1 Hr,Valid
Beijing,PM2.5,1/14/2016 10:00,2016,1,14,10,132,µg/m³,1 Hr,Valid
Beijing,PM2.5,1/14/2016 11:00,2016,1,14,11,85,µg/m³,1 Hr,Valid
Beijing,PM2.5,1/14/2016 12:00,2016,1,14,12,84,µg/m³,1 Hr,Valid
Beijing,PM2.5,1/14/2016 13:00,2016,1,14,13,78,µg/m³,1 Hr,Valid
Beijing,PM2.5,1/14/2016 14:00,2016,1,14,14,47,µg/m³,1 Hr,Valid
Beijing,PM2.5,1/14/2016 15:00,2016,1,14,15,30,µg/m³,1 Hr,Valid
Beijing,PM2.5,1/14/2016 16:00,2016,1,14,16,29,µg/m³,1 Hr,Valid
Beijing,PM2.5,1/14/2016 17:00,2016,1,14,17,80,µg/m³,1 Hr,Valid
Beijing,PM2.5,1/14/2016 18:00,2016,1,14,18,90,µg/m³,1 Hr,Valid
Beijing,PM2.5,1/14/2016 19:00,2016,1,14,19,88,µg/m³,1 Hr,Valid
Beijing,PM2.5,1/14/2016 20:00,2016,1,14,20,95,µg/m³,1 Hr,Valid
Beijing,PM2.5,1/14/2016 21:00,2016,1,14,21,109,µg/m³,1 Hr,Valid
Beijing,PM2.5,1/14/2016 22:00,2016,1,14,22,120,µg/m³,1 Hr,Valid
Beijing,PM2.5,1/14/2016 23:00,2016,1,14,23,134,µg/m³,1 Hr,Valid
Beijing,PM2.5,1/15/2016 0:00,2016,1,15,0,150,µg/m³,1 Hr,Valid
Beijing,PM2.5,1/15/2016 1:00,2016,1,15,1,164,µg/m³,1 Hr,Valid
Beijing,PM2.5,1/15/2016 2:00,2016,1,15,2,159,µg/m³,1 Hr,Valid
Beijing,PM2.5,1/15/2016 3:00,2016,1,15,3,116,µg/m³,1 Hr,Valid
Beijing,PM2.5,1/15/2016 4:00,2016,1,15,4,126,µg/m³,1 Hr,Valid
Beijing,PM2.5,1/15/2016 5:00,2016,1,15,5,128,µg/m³,1 Hr,Valid
Beijing,PM2.5,1/15/2016 6:00,2016,1,15,6,132,µg/m³,1 Hr,Valid
Beijing,PM2.5,1/15/2016 7:00,2016,1,15,7,146,µg/m³,1 Hr,Valid
Beijing,PM2.5,1/15/2016 8:00,2016,1,15,8,82,µg/m³,1 Hr,Valid
Beijing,PM2.5,1/15/2016 9:00,2016,1,15,9,74,µg/m³,1 Hr,Valid
Beijing,PM2.5,1/15/2016 10:00,2016,1,15,10,63,µg/m³,1 Hr,Valid
Beijing,PM2.5,1/15/2016 11:00,2016,1,15,11,59,µg/m³,1 Hr,Valid
Beijing,PM2.5,1/15/2016 12:00,2016,1,15,12,50,µg/m³,1 Hr,Valid
Beijing,PM2.5,1/15/2016 13:00,2016,1,15,13,76,µg/m³,1 Hr,Valid
Beijing,PM2.5,1/15/2016 14:00,2016,1,15,14,86,µg/m³,1 Hr,Valid
Beijing,PM2.5,1/15/2016 15:00,2016,1,15,15,81,µg/m³,1 Hr,Valid
Beijing,PM2.5,1/15/2016 16:00,2016,1,15,16,88,µg/m³,1 Hr,Valid
Beijing,PM2.5,1/15/2016 17:00,2016,1,15,17,89,µg/m³,1 Hr,Valid
Beijing,PM2.5,1/15/2016 18:00,2016,1,15,18,102,µg/m³,1 Hr,Valid
Beijing,PM2.5,1/15/2016 19:00,2016,1,15,19,112,µg/m³,1 Hr,Valid
Beijing,PM2.5,1/15/2016 20:00,2016,1,15,20,115,µg/m³,1 Hr,Valid
Beijing,PM2.5,1/15/2016 21:00,2016,1,15,21,193,µg/m³,1 Hr,Valid
Beijing,PM2.5,1/15/2016 22:00,2016,1,15,22,230,µg/m³,1 Hr,Valid
Beijing,PM2.5,1/15/2016 23:00,2016,1,15,23,222,µg/m³,1 Hr,Valid
Beijing,PM2.5,1/16/2016 0:00,2016,1,16,0,155,µg/m³,1 Hr,Valid
Beijing,PM2.5,1/16/2016 1:00,2016,1,16,1,142,µg/m³,1 Hr,Valid
Beijing,PM2.5,1/16/2016 2:00,2016,1,16,2,117,µg/m³,1 Hr,Valid
Beijing,PM2.5,1/16/2016 3:00,2016,1,16,3,106,µg/m³,1 Hr,Valid
Beijing,PM2.5,1/16/2016 4:00,2016,1,16,4,94,µg/m³,1 Hr,Valid
Beijing,PM2.5,1/16/2016 5:00,2016,1,16,5,88,µg/m³,1 Hr,Valid
Beijing,PM2.5,1/16/2016 6:00,2016,1,16,6,82,µg/m³,1 Hr,Valid
Beijing,PM2.5,1/16/2016 7:00,2016,1,16,7,90,µg/m³,1 Hr,Valid
Beijing,PM2.5,1/16/2016 8:00,2016,1,16,8,93,µg/m³,1 Hr,Valid
Beijing,PM2.5,1/16/2016 9:00,2016,1,16,9,96,µg/m³,1 Hr,Valid
Beijing,PM2.5,1/16/2016 10:00,2016,1,16,10,108,µg/m³,1 Hr,Valid
Beijing,PM2.5,1/16/2016 11:00,2016,1,16,11,109,µg/m³,1 Hr,Valid
Beijing,PM2.5,1/16/2016 12:00,2016,1,16,12,93,µg/m³,1 Hr,Valid
Beijing,PM2.5,1/16/2016 13:00,2016,1,16,13,121,µg/m³,1 Hr,Valid
Beijing,PM2.5,1/16/2016 14:00,2016,1,16,14,112,µg/m³,1 Hr,Valid
Beijing,PM2.5,1/16/2016 15:00,2016,1,16,15,116,µg/m³,1 Hr,Valid
Beijing,PM2.5,1/16/2016 16:00,2016,1,16,16,141,µg/m³,1 Hr,Valid
Beijing,PM2.5,1/16/2016 17:00,2016,1,16,17,136,µg/m³,1 Hr,Valid
Beijing,PM2.5,1/16/2016 18:00,2016,1,16,18,139,µg/m³,1 Hr,Valid
Beijing,PM2.5,1/16/2016 19:00,2016,1,16,19,151,µg/m³,1 Hr,Valid
Beijing,PM2.5,1/16/2016 20:00,2016,1,16,20,144,µg/m³,1 Hr,Valid
Beijing,PM2.5,1/16/2016 21:00,2016,1,16,21,152,µg/m³,1 Hr,Valid
Beijing,PM2.5,1/16/2016 22:00,2016,1,16,22,149,µg/m³,1 Hr,Valid
Beijing,PM2.5,1/16/2016 23:00,2016,1,16,23,156,µg/m³,1 Hr,Valid
Beijing,PM2.5,1/17/2016 0:00,2016,1,17,0,154,µg/m³,1 Hr,Valid
Beijing,PM2.5,1/17/2016 1:00,2016,1,17,1,100,µg/m³,1 Hr,Valid
Beijing,PM2.5,1/17/2016 2:00,2016,1,17,2,70,µg/m³,1 Hr,Valid
Beijing,PM2.5,1/17/2016 3:00,2016,1,17,3,71,µg/m³,1 Hr,Valid
Beijing,PM2.5,1/17/2016 4:00,2016,1,17,4,34,µg/m³,1 Hr,Valid
Beijing,PM2.5,1/17/2016 5:00,2016,1,17,5,18,µg/m³,1 Hr,Valid
Beijing,PM2.5,1/17/2016 6:00,2016,1,17,6,20,µg/m³,1 Hr,Valid
Beijing,PM2.5,1/17/2016 7:00,2016,1,17,7,16,µg/m³,1 Hr,Valid
Beijing,PM2.5,1/17/2016 8:00,2016,1,17,8,16,µg/m³,1 Hr,Valid
Beijing,PM2.5,1/17/2016 9:00,2016,1,17,9,19,µg/m³,1 Hr,Valid
Beijing,PM2.5,1/17/2016 10:00,2016,1,17,10,20,µg/m³,1 Hr,Valid
Beijing,PM2.5,1/17/2016 11:00,2016,1,17,11,20,µg/m³,1 Hr,Valid
Beijing,PM2.5,1/17/2016 12:00,2016,1,17,12,13,µg/m³,1 Hr,Valid
Beijing,PM2.5,1/17/2016 13:00,2016,1,17,13,13,µg/m³,1 Hr,Valid
Beijing,PM2.5,1/17/2016 14:00,2016,1,17,14,16,µg/m³,1 Hr,Valid
Beijing,PM2.5,1/17/2016 15:00,2016,1,17,15,13,µg/m³,1 Hr,Valid
Beijing,PM2.5,1/17/2016 16:00,2016,1,17,16,13,µg/m³,1 Hr,Valid
Beijing,PM2.5,1/17/2016 17:00,2016,1,17,17,17,µg/m³,1 Hr,Valid
Beijing,PM2.5,1/17/2016 18:00,2016,1,17,18,14,µg/m³,1 Hr,Valid
Beijing,PM2.5,1/17/2016 19:00,2016,1,17,19,16,µg/m³,1 Hr,Valid
Beijing,PM2.5,1/17/2016 20:00,2016,1,17,20,21,µg/m³,1 Hr,Valid
Beijing,PM2.5,1/17/2016 21:00,2016,1,17,21,19,µg/m³,1 Hr,Valid
Beijing,PM2.5,1/17/2016 22:00,2016,1,17,22,22,µg/m³,1 Hr,Valid
Beijing,PM2.5,1/17/2016 23:00,2016,1,17,23,11,µg/m³,1 Hr,Valid
Beijing,PM2.5,1/18/2016 0:00,2016,1,18,0,7,µg/m³,1 Hr,Valid
Beijing,PM2.5,1/18/2016 1:00,2016,1,18,1,6,µg/m³,1 Hr,Valid
Beijing,PM2.5,1/18/2016 2:00,2016,1,18,2,6,µg/m³,1 Hr,Valid
Beijing,PM2.5,1/18/2016 3:00,2016,1,18,3,4,µg/m³,1 Hr,Valid
Beijing,PM2.5,1/18/2016 4:00,2016,1,18,4,2,µg/m³,1 Hr,Valid
Beijing,PM2.5,1/18/2016 5:00,2016,1,18,5,9,µg/m³,1 Hr,Valid
Beijing,PM2.5,1/18/2016 6:00,2016,1,18,6,7,µg/m³,1 Hr,Valid
Beijing,PM2.5,1/18/2016 7:00,2016,1,18,7,10,µg/m³,1 Hr,Valid
Beijing,PM2.5,1/18/2016 8:00,2016,1,18,8,10,µg/m³,1 Hr,Valid
Beijing,PM2.5,1/18/2016 9:00,2016,1,18,9,7,µg/m³,1 Hr,Valid
Beijing,PM2.5,1/18/2016 10:00,2016,1,18,10,8,µg/m³,1 Hr,Valid
Beijing,PM2.5,1/18/2016 11:00,2016,1,18,11,8,µg/m³,1 Hr,Valid
Beijing,PM2.5,1/18/2016 12:00,2016,1,18,12,7,µg/m³,1 Hr,Valid
Beijing,PM2.5,1/18/2016 13:00,2016,1,18,13,10,µg/m³,1 Hr,Valid
Beijing,PM2.5,1/18/2016 14:00,2016,1,18,14,16,µg/m³,1 Hr,Valid
Beijing,PM2.5,1/18/2016 15:00,2016,1,18,15,8,µg/m³,1 Hr,Valid
Beijing,PM2.5,1/18/2016 16:00,2016,1,18,16,6,µg/m³,1 Hr,Valid
Beijing,PM2.5,1/18/2016 17:00,2016,1,18,17,8,µg/m³,1 Hr,Valid
Beijing,PM2.5,1/18/2016 18:00,2016,1,18,18,15,µg/m³,1 Hr,Valid
Beijing,PM2.5,1/18/2016 19:00,2016,1,18,19,14,µg/m³,1 Hr,Valid
Beijing,PM2.5,1/18/2016 20:00,2016,1,18,20,16,µg/m³,1 Hr,Valid
Beijing,PM2.5,1/18/2016 21:00,2016,1,18,21,19,µg/m³,1 Hr,Valid
Beijing,PM2.5,1/18/2016 22:00,2016,1,18,22,21,µg/m³,1 Hr,Valid
Beijing,PM2.5,1/18/2016 23:00,2016,1,18,23,25,µg/m³,1 Hr,Valid
Beijing,PM2.5,1/19/2016 0:00,2016,1,19,0,31,µg/m³,1 Hr,Valid
Beijing,PM2.5,1/19/2016 1:00,2016,1,19,1,20,µg/m³,1 Hr,Valid
Beijing,PM2.5,1/19/2016 2:00,2016,1,19,2,32,µg/m³,1 Hr,Valid
Beijing,PM2.5,1/19/2016 3:00,2016,1,19,3,30,µg/m³,1 Hr,Valid
Beijing,PM2.5,1/19/2016 4:00,2016,1,19,4,19,µg/m³,1 Hr,Valid
Beijing,PM2.5,1/19/2016 5:00,2016,1,19,5,45,µg/m³,1 Hr,Valid
Beijing,PM2.5,1/19/2016 6:00,2016,1,19,6,32,µg/m³,1 Hr,Valid
Beijing,PM2.5,1/19/2016 7:00,2016,1,19,7,32,µg/m³,1 Hr,Valid
Beijing,PM2.5,1/19/2016 8:00,2016,1,19,8,26,µg/m³,1 Hr,Valid
Beijing,PM2.5,1/19/2016 9:00,2016,1,19,9,36,µg/m³,1 Hr,Valid
Beijing,PM2.5,1/19/2016 10:00,2016,1,19,10,-999,µg/m³,1 Hr,Missing
Beijing,PM2.5,1/19/2016 11:00,2016,1,19,11,90,µg/m³,1 Hr,Valid
Beijing,PM2.5,1/19/2016 12:00,2016,1,19,12,101,µg/m³,1 Hr,Valid
Beijing,PM2.5,1/19/2016 13:00,2016,1,19,13,124,µg/m³,1 Hr,Valid
Beijing,PM2.5,1/19/2016 14:00,2016,1,19,14,76,µg/m³,1 Hr,Valid
Beijing,PM2.5,1/19/2016 15:00,2016,1,19,15,77,µg/m³,1 Hr,Valid
Beijing,PM2.5,1/19/2016 16:00,2016,1,19,16,62,µg/m³,1 Hr,Valid
Beijing,PM2.5,1/19/2016 17:00,2016,1,19,17,64,µg/m³,1 Hr,Valid
Beijing,PM2.5,1/19/2016 18:00,2016,1,19,18,80,µg/m³,1 Hr,Valid
Beijing,PM2.5,1/19/2016 19:00,2016,1,19,19,92,µg/m³,1 Hr,Valid
Beijing,PM2.5,1/19/2016 20:00,2016,1,19,20,98,µg/m³,1 Hr,Valid
Beijing,PM2.5,1/19/2016 21:00,2016,1,19,21,128,µg/m³,1 Hr,Valid
Beijing,PM2.5,1/19/2016 22:00,2016,1,19,22,127,µg/m³,1 Hr,Valid
Beijing,PM2.5,1/19/2016 23:00,2016,1,19,23,143,µg/m³,1 Hr,Valid
Beijing,PM2.5,1/20/2016 0:00,2016,1,20,0,171,µg/m³,1 Hr,Valid
Beijing,PM2.5,1/20/2016 1:00,2016,1,20,1,193,µg/m³,1 Hr,Valid
Beijing,PM2.5,1/20/2016 2:00,2016,1,20,2,181,µg/m³,1 Hr,Valid
Beijing,PM2.5,1/20/2016 3:00,2016,1,20,3,146,µg/m³,1 Hr,Valid
Beijing,PM2.5,1/20/2016 4:00,2016,1,20,4,130,µg/m³,1 Hr,Valid
Beijing,PM2.5,1/20/2016 5:00,2016,1,20,5,135,µg/m³,1 Hr,Valid
Beijing,PM2.5,1/20/2016 6:00,2016,1,20,6,143,µg/m³,1 Hr,Valid
Beijing,PM2.5,1/20/2016 7:00,2016,1,20,7,132,µg/m³,1 Hr,Valid
Beijing,PM2.5,1/20/2016 8:00,2016,1,20,8,125,µg/m³,1 Hr,Valid
Beijing,PM2.5,1/20/2016 9:00,2016,1,20,9,132,µg/m³,1 Hr,Valid
Beijing,PM2.5,1/20/2016 10:00,2016,1,20,10,144,µg/m³,1 Hr,Valid
Beijing,PM2.5,1/20/2016 11:00,2016,1,20,11,138,µg/m³,1 Hr,Valid
Beijing,PM2.5,1/20/2016 12:00,2016,1,20,12,158,µg/m³,1 Hr,Valid
Beijing,PM2.5,1/20/2016 13:00,2016,1,20,13,158,µg/m³,1 Hr,Valid
Beijing,PM2.5,1/20/2016 14:00,2016,1,20,14,140,µg/m³,1 Hr,Valid
Beijing,PM2.5,1/20/2016 15:00,2016,1,20,15,141,µg/m³,1 Hr,Valid
Beijing,PM2.5,1/20/2016 16:00,2016,1,20,16,135,µg/m³,1 Hr,Valid
Beijing,PM2.5,1/20/2016 17:00,2016,1,20,17,141,µg/m³,1 Hr,Valid
Beijing,PM2.5,1/20/2016 18:00,2016,1,20,18,163,µg/m³,1 Hr,Valid
Beijing,PM2.5,1/20/2016 19:00,2016,1,20,19,161,µg/m³,1 Hr,Valid
Beijing,PM2.5,1/20/2016 20:00,2016,1,20,20,185,µg/m³,1 Hr,Valid
Beijing,PM2.5,1/20/2016 21:00,2016,1,20,21,205,µg/m³,1 Hr,Valid
Beijing,PM2.5,1/20/2016 22:00,2016,1,20,22,193,µg/m³,1 Hr,Valid
Beijing,PM2.5,1/20/2016 23:00,2016,1,20,23,165,µg/m³,1 Hr,Valid
Beijing,PM2.5,1/21/2016 0:00,2016,1,21,0,134,µg/m³,1 Hr,Valid
Beijing,PM2.5,1/21/2016 1:00,2016,1,21,1,118,µg/m³,1 Hr,Valid
Beijing,PM2.5,1/21/2016 2:00,2016,1,21,2,114,µg/m³,1 Hr,Valid
Beijing,PM2.5,1/21/2016 3:00,2016,1,21,3,112,µg/m³,1 Hr,Valid
Beijing,PM2.5,1/21/2016 4:00,2016,1,21,4,106,µg/m³,1 Hr,Valid
Beijing,PM2.5,1/21/2016 5:00,2016,1,21,5,97,µg/m³,1 Hr,Valid
Beijing,PM2.5,1/21/2016 6:00,2016,1,21,6,90,µg/m³,1 Hr,Valid
Beijing,PM2.5,1/21/2016 7:00,2016,1,21,7,96,µg/m³,1 Hr,Valid
Beijing,PM2.5,1/21/2016 8:00,2016,1,21,8,101,µg/m³,1 Hr,Valid
Beijing,PM2.5,1/21/2016 9:00,2016,1,21,9,131,µg/m³,1 Hr,Valid
Beijing,PM2.5,1/21/2016 10:00,2016,1,21,10,159,µg/m³,1 Hr,Valid
Beijing,PM2.5,1/21/2016 11:00,2016,1,21,11,158,µg/m³,1 Hr,Valid
Beijing,PM2.5,1/21/2016 12:00,2016,1,21,12,156,µg/m³,1 Hr,Valid
Beijing,PM2.5,1/21/2016 13:00,2016,1,21,13,158,µg/m³,1 Hr,Valid
Beijing,PM2.5,1/21/2016 14:00,2016,1,21,14,152,µg/m³,1 Hr,Valid
Beijing,PM2.5,1/21/2016 15:00,2016,1,21,15,146,µg/m³,1 Hr,Valid
Beijing,PM2.5,1/21/2016 16:00,2016,1,21,16,165,µg/m³,1 Hr,Valid
Beijing,PM2.5,1/21/2016 17:00,2016,1,21,17,167,µg/m³,1 Hr,Valid
Beijing,PM2.5,1/21/2016 18:00,2016,1,21,18,148,µg/m³,1 Hr,Valid
Beijing,PM2.5,1/21/2016 19:00,2016,1,21,19,160,µg/m³,1 Hr,Valid
Beijing,PM2.5,1/21/2016 20:00,2016,1,21,20,162,µg/m³,1 Hr,Valid
Beijing,PM2.5,1/21/2016 21:00,2016,1,21,21,185,µg/m³,1 Hr,Valid
Beijing,PM2.5,1/21/2016 22:00,2016,1,21,22,179,µg/m³,1 Hr,Valid
Beijing,PM2.5,1/21/2016 23:00,2016,1,21,23,150,µg/m³,1 Hr,Valid
Beijing,PM2.5,1/22/2016 0:00,2016,1,22,0,133,µg/m³,1 Hr,Valid
Beijing,PM2.5,1/22/2016 1:00,2016,1,22,1,12,µg/m³,1 Hr,Valid
Beijing,PM2.5,1/22/2016 2:00,2016,1,22,2,10,µg/m³,1 Hr,Valid
Beijing,PM2.5,1/22/2016 3:00,2016,1,22,3,12,µg/m³,1 Hr,Valid
Beijing,PM2.5,1/22/2016 4:00,2016,1,22,4,9,µg/m³,1 Hr,Valid
Beijing,PM2.5,1/22/2016 5:00,2016,1,22,5,7,µg/m³,1 Hr,Valid
Beijing,PM2.5,1/22/2016 6:00,2016,1,22,6,7,µg/m³,1 Hr,Valid
Beijing,PM2.5,1/22/2016 7:00,2016,1,22,7,6,µg/m³,1 Hr,Valid
Beijing,PM2.5,1/22/2016 8:00,2016,1,22,8,8,µg/m³,1 Hr,Valid
Beijing,PM2.5,1/22/2016 9:00,2016,1,22,9,9,µg/m³,1 Hr,Valid
Beijing,PM2.5,1/22/2016 10:00,2016,1,22,10,8,µg/m³,1 Hr,Valid
Beijing,PM2.5,1/22/2016 11:00,2016,1,22,11,6,µg/m³,1 Hr,Valid
Beijing,PM2.5,1/22/2016 12:00,2016,1,22,12,11,µg/m³,1 Hr,Valid
Beijing,PM2.5,1/22/2016 13:00,2016,1,22,13,8,µg/m³,1 Hr,Valid
Beijing,PM2.5,1/22/2016 14:00,2016,1,22,14,7,µg/m³,1 Hr,Valid
Beijing,PM2.5,1/22/2016 15:00,2016,1,22,15,8,µg/m³,1 Hr,Valid
Beijing,PM2.5,1/22/2016 16:00,2016,1,22,16,8,µg/m³,1 Hr,Valid
Beijing,PM2.5,1/22/2016 17:00,2016,1,22,17,10,µg/m³,1 Hr,Valid
Beijing,PM2.5,1/22/2016 18:00,2016,1,22,18,8,µg/m³,1 Hr,Valid
Beijing,PM2.5,1/22/2016 19:00,2016,1,22,19,13,µg/m³,1 Hr,Valid
Beijing,PM2.5,1/22/2016 20:00,2016,1,22,20,10,µg/m³,1 Hr,Valid
Beijing,PM2.5,1/22/2016 21:00,2016,1,22,21,8,µg/m³,1 Hr,Valid
Beijing,PM2.5,1/22/2016 22:00,2016,1,22,22,11,µg/m³,1 Hr,Valid
Beijing,PM2.5,1/22/2016 23:00,2016,1,22,23,20,µg/m³,1 Hr,Valid
Beijing,PM2.5,1/23/2016 0:00,2016,1,23,0,22,µg/m³,1 Hr,Valid
Beijing,PM2.5,1/23/2016 1:00,2016,1,23,1,25,µg/m³,1 Hr,Valid
Beijing,PM2.5,1/23/2016 2:00,2016,1,23,2,27,µg/m³,1 Hr,Valid
Beijing,PM2.5,1/23/2016 3:00,2016,1,23,3,15,µg/m³,1 Hr,Valid
Beijing,PM2.5,1/23/2016 4:00,2016,1,23,4,8,µg/m³,1 Hr,Valid
Beijing,PM2.5,1/23/2016 5:00,2016,1,23,5,6,µg/m³,1 Hr,Valid
Beijing,PM2.5,1/23/2016 6:00,2016,1,23,6,8,µg/m³,1 Hr,Valid
Beijing,PM2.5,1/23/2016 7:00,2016,1,23,7,10,µg/m³,1 Hr,Valid
Beijing,PM2.5,1/23/2016 8:00,2016,1,23,8,8,µg/m³,1 Hr,Valid
Beijing,PM2.5,1/23/2016 9:00,2016,1,23,9,14,µg/m³,1 Hr,Valid
Beijing,PM2.5,1/23/2016 10:00,2016,1,23,10,12,µg/m³,1 Hr,Valid
Beijing,PM2.5,1/23/2016 11:00,2016,1,23,11,8,µg/m³,1 Hr,Valid
Beijing,PM2.5,1/23/2016 12:00,2016,1,23,12,11,µg/m³,1 Hr,Valid
Beijing,PM2.5,1/23/2016 13:00,2016,1,23,13,12,µg/m³,1 Hr,Valid
Beijing,PM2.5,1/23/2016 14:00,2016,1,23,14,8,µg/m³,1 Hr,Valid
Beijing,PM2.5,1/23/2016 15:00,2016,1,23,15,9,µg/m³,1 Hr,Valid
Beijing,PM2.5,1/23/2016 16:00,2016,1,23,16,9,µg/m³,1 Hr,Valid
Beijing,PM2.5,1/23/2016 17:00,2016,1,23,17,12,µg/m³,1 Hr,Valid
Beijing,PM2.5,1/23/2016 18:00,2016,1,23,18,14,µg/m³,1 Hr,Valid
Beijing,PM2.5,1/23/2016 19:00,2016,1,23,19,9,µg/m³,1 Hr,Valid
Beijing,PM2.5,1/23/2016 20:00,2016,1,23,20,9,µg/m³,1 Hr,Valid
Beijing,PM2.5,1/23/2016 21:00,2016,1,23,21,9,µg/m³,1 Hr,Valid
Beijing,PM2.5,1/23/2016 22:00,2016,1,23,22,13,µg/m³,1 Hr,Valid
Beijing,PM2.5,1/23/2016 23:00,2016,1,23,23,12,µg/m³,1 Hr,Valid
Beijing,PM2.5,1/24/2016 0:00,2016,1,24,0,11,µg/m³,1 Hr,Valid
Beijing,PM2.5,1/24/2016 1:00,2016,1,24,1,9,µg/m³,1 Hr,Valid
Beijing,PM2.5,1/24/2016 2:00,2016,1,24,2,5,µg/m³,1 Hr,Valid
Beijing,PM2.5,1/24/2016 3:00,2016,1,24,3,7,µg/m³,1 Hr,Valid
Beijing,PM2.5,1/24/2016 4:00,2016,1,24,4,9,µg/m³,1 Hr,Valid
Beijing,PM2.5,1/24/2016 5:00,2016,1,24,5,7,µg/m³,1 Hr,Valid
Beijing,PM2.5,1/24/2016 6:00,2016,1,24,6,6,µg/m³,1 Hr,Valid
Beijing,PM2.5,1/24/2016 7:00,2016,1,24,7,7,µg/m³,1 Hr,Valid
Beijing,PM2.5,1/24/2016 8:00,2016,1,24,8,6,µg/m³,1 Hr,Valid
Beijing,PM2.5,1/24/2016 9:00,2016,1,24,9,14,µg/m³,1 Hr,Valid
Beijing,PM2.5,1/24/2016 10:00,2016,1,24,10,16,µg/m³,1 Hr,Valid
Beijing,PM2.5,1/24/2016 11:00,2016,1,24,11,13,µg/m³,1 Hr,Valid
Beijing,PM2.5,1/24/2016 12:00,2016,1,24,12,10,µg/m³,1 Hr,Valid
Beijing,PM2.5,1/24/2016 13:00,2016,1,24,13,11,µg/m³,1 Hr,Valid
Beijing,PM2.5,1/24/2016 14:00,2016,1,24,14,15,µg/m³,1 Hr,Valid
Beijing,PM2.5,1/24/2016 15:00,2016,1,24,15,10,µg/m³,1 Hr,Valid
Beijing,PM2.5,1/24/2016 16:00,2016,1,24,16,12,µg/m³,1 Hr,Valid
Beijing,PM2.5,1/24/2016 17:00,2016,1,24,17,20,µg/m³,1 Hr,Valid
Beijing,PM2.5,1/24/2016 18:00,2016,1,24,18,18,µg/m³,1 Hr,Valid
Beijing,PM2.5,1/24/2016 19:00,2016,1,24,19,19,µg/m³,1 Hr,Valid
Beijing,PM2.5,1/24/2016 20:00,2016,1,24,20,26,µg/m³,1 Hr,Valid
Beijing,PM2.5,1/24/2016 21:00,2016,1,24,21,22,µg/m³,1 Hr,Valid
Beijing,PM2.5,1/24/2016 22:00,2016,1,24,22,21,µg/m³,1 Hr,Valid
Beijing,PM2.5,1/24/2016 23:00,2016,1,24,23,19,µg/m³,1 Hr,Valid
Beijing,PM2.5,1/25/2016 0:00,2016,1,25,0,13,µg/m³,1 Hr,Valid
Beijing,PM2.5,1/25/2016 1:00,2016,1,25,1,14,µg/m³,1 Hr,Valid
Beijing,PM2.5,1/25/2016 2:00,2016,1,25,2,19,µg/m³,1 Hr,Valid
Beijing,PM2.5,1/25/2016 3:00,2016,1,25,3,13,µg/m³,1 Hr,Valid
Beijing,PM2.5,1/25/2016 4:00,2016,1,25,4,12,µg/m³,1 Hr,Valid
Beijing,PM2.5,1/25/2016 5:00,2016,1,25,5,14,µg/m³,1 Hr,Valid
Beijing,PM2.5,1/25/2016 6:00,2016,1,25,6,14,µg/m³,1 Hr,Valid
Beijing,PM2.5,1/25/2016 7:00,2016,1,25,7,15,µg/m³,1 Hr,Valid
Beijing,PM2.5,1/25/2016 8:00,2016,1,25,8,20,µg/m³,1 Hr,Valid
Beijing,PM2.5,1/25/2016 9:00,2016,1,25,9,14,µg/m³,1 Hr,Valid
Beijing,PM2.5,1/25/2016 10:00,2016,1,25,10,21,µg/m³,1 Hr,Valid
Beijing,PM2.5,1/25/2016 11:00,2016,1,25,11,12,µg/m³,1 Hr,Valid
Beijing,PM2.5,1/25/2016 12:00,2016,1,25,12,17,µg/m³,1 Hr,Valid
Beijing,PM2.5,1/25/2016 13:00,2016,1,25,13,18,µg/m³,1 Hr,Valid
Beijing,PM2.5,1/25/2016 14:00,2016,1,25,14,17,µg/m³,1 Hr,Valid
Beijing,PM2.5,1/25/2016 15:00,2016,1,25,15,16,µg/m³,1 Hr,Valid
Beijing,PM2.5,1/25/2016 16:00,2016,1,25,16,14,µg/m³,1 Hr,Valid
Beijing,PM2.5,1/25/2016 17:00,2016,1,25,17,22,µg/m³,1 Hr,Valid
Beijing,PM2.5,1/25/2016 18:00,2016,1,25,18,31,µg/m³,1 Hr,Valid
Beijing,PM2.5,1/25/2016 19:00,2016,1,25,19,37,µg/m³,1 Hr,Valid
Beijing,PM2.5,1/25/2016 20:00,2016,1,25,20,40,µg/m³,1 Hr,Valid
Beijing,PM2.5,1/25/2016 21:00,2016,1,25,21,40,µg/m³,1 Hr,Valid
Beijing,PM2.5,1/25/2016 22:00,2016,1,25,22,45,µg/m³,1 Hr,Valid
Beijing,PM2.5,1/25/2016 23:00,2016,1,25,23,42,µg/m³,1 Hr,Valid
Beijing,PM2.5,1/26/2016 0:00,2016,1,26,0,29,µg/m³,1 Hr,Valid
Beijing,PM2.5,1/26/2016 1:00,2016,1,26,1,22,µg/m³,1 Hr,Valid
Beijing,PM2.5,1/26/2016 2:00,2016,1,26,2,20,µg/m³,1 Hr,Valid
Beijing,PM2.5,1/26/2016 3:00,2016,1,26,3,17,µg/m³,1 Hr,Valid
Beijing,PM2.5,1/26/2016 4:00,2016,1,26,4,14,µg/m³,1 Hr,Valid
Beijing,PM2.5,1/26/2016 5:00,2016,1,26,5,17,µg/m³,1 Hr,Valid
Beijing,PM2.5,1/26/2016 6:00,2016,1,26,6,20,µg/m³,1 Hr,Valid
Beijing,PM2.5,1/26/2016 7:00,2016,1,26,7,23,µg/m³,1 Hr,Valid
Beijing,PM2.5,1/26/2016 8:00,2016,1,26,8,19,µg/m³,1 Hr,Valid
Beijing,PM2.5,1/26/2016 9:00,2016,1,26,9,23,µg/m³,1 Hr,Valid
Beijing,PM2.5,1/26/2016 10:00,2016,1,26,10,21,µg/m³,1 Hr,Valid
Beijing,PM2.5,1/26/2016 11:00,2016,1,26,11,15,µg/m³,1 Hr,Valid
Beijing,PM2.5,1/26/2016 12:00,2016,1,26,12,16,µg/m³,1 Hr,Valid
Beijing,PM2.5,1/26/2016 13:00,2016,1,26,13,16,µg/m³,1 Hr,Valid
Beijing,PM2.5,1/26/2016 14:00,2016,1,26,14,18,µg/m³,1 Hr,Valid
Beijing,PM2.5,1/26/2016 15:00,2016,1,26,15,23,µg/m³,1 Hr,Valid
Beijing,PM2.5,1/26/2016 16:00,2016,1,26,16,22,µg/m³,1 Hr,Valid
Beijing,PM2.5,1/26/2016 17:00,2016,1,26,17,27,µg/m³,1 Hr,Valid
Beijing,PM2.5,1/26/2016 18:00,2016,1,26,18,30,µg/m³,1 Hr,Valid
Beijing,PM2.5,1/26/2016 19:00,2016,1,26,19,36,µg/m³,1 Hr,Valid
Beijing,PM2.5,1/26/2016 20:00,2016,1,26,20,90,µg/m³,1 Hr,Valid
Beijing,PM2.5,1/26/2016 21:00,2016,1,26,21,104,µg/m³,1 Hr,Valid
Beijing,PM2.5,1/26/2016 22:00,2016,1,26,22,105,µg/m³,1 Hr,Valid
Beijing,PM2.5,1/26/2016 23:00,2016,1,26,23,115,µg/m³,1 Hr,Valid
Beijing,PM2.5,1/27/2016 0:00,2016,1,27,0,121,µg/m³,1 Hr,Valid
Beijing,PM2.5,1/27/2016 1:00,2016,1,27,1,111,µg/m³,1 Hr,Valid
Beijing,PM2.5,1/27/2016 2:00,2016,1,27,2,123,µg/m³,1 Hr,Valid
Beijing,PM2.5,1/27/2016 3:00,2016,1,27,3,134,µg/m³,1 Hr,Valid
Beijing,PM2.5,1/27/2016 4:00,2016,1,27,4,119,µg/m³,1 Hr,Valid
Beijing,PM2.5,1/27/2016 5:00,2016,1,27,5,102,µg/m³,1 Hr,Valid
Beijing,PM2.5,1/27/2016 6:00,2016,1,27,6,88,µg/m³,1 Hr,Valid
Beijing,PM2.5,1/27/2016 7:00,2016,1,27,7,70,µg/m³,1 Hr,Valid
Beijing,PM2.5,1/27/2016 8:00,2016,1,27,8,58,µg/m³,1 Hr,Valid
Beijing,PM2.5,1/27/2016 9:00,2016,1,27,9,50,µg/m³,1 Hr,Valid
Beijing,PM2.5,1/27/2016 10:00,2016,1,27,10,54,µg/m³,1 Hr,Valid
Beijing,PM2.5,1/27/2016 11:00,2016,1,27,11,33,µg/m³,1 Hr,Valid
Beijing,PM2.5,1/27/2016 12:00,2016,1,27,12,54,µg/m³,1 Hr,Valid
Beijing,PM2.5,1/27/2016 13:00,2016,1,27,13,67,µg/m³,1 Hr,Valid
Beijing,PM2.5,1/27/2016 14:00,2016,1,27,14,87,µg/m³,1 Hr,Valid
Beijing,PM2.5,1/27/2016 15:00,2016,1,27,15,126,µg/m³,1 Hr,Valid
Beijing,PM2.5,1/27/2016 16:00,2016,1,27,16,143,µg/m³,1 Hr,Valid
Beijing,PM2.5,1/27/2016 17:00,2016,1,27,17,137,µg/m³,1 Hr,Valid
Beijing,PM2.5,1/27/2016 18:00,2016,1,27,18,139,µg/m³,1 Hr,Valid
Beijing,PM2.5,1/27/2016 19:00,2016,1,27,19,159,µg/m³,1 Hr,Valid
Beijing,PM2.5,1/27/2016 20:00,2016,1,27,20,170,µg/m³,1 Hr,Valid
Beijing,PM2.5,1/27/2016 21:00,2016,1,27,21,206,µg/m³,1 Hr,Valid
Beijing,PM2.5,1/27/2016 22:00,2016,1,27,22,227,µg/m³,1 Hr,Valid
Beijing,PM2.5,1/27/2016 23:00,2016,1,27,23,309,µg/m³,1 Hr,Valid
Beijing,PM2.5,1/28/2016 0:00,2016,1,28,0,344,µg/m³,1 Hr,Valid
Beijing,PM2.5,1/28/2016 1:00,2016,1,28,1,280,µg/m³,1 Hr,Valid
Beijing,PM2.5,1/28/2016 2:00,2016,1,28,2,256,µg/m³,1 Hr,Valid
Beijing,PM2.5,1/28/2016 3:00,2016,1,28,3,241,µg/m³,1 Hr,Valid
Beijing,PM2.5,1/28/2016 4:00,2016,1,28,4,164,µg/m³,1 Hr,Valid
Beijing,PM2.5,1/28/2016 5:00,2016,1,28,5,132,µg/m³,1 Hr,Valid
Beijing,PM2.5,1/28/2016 6:00,2016,1,28,6,149,µg/m³,1 Hr,Valid
Beijing,PM2.5,1/28/2016 7:00,2016,1,28,7,145,µg/m³,1 Hr,Valid
Beijing,PM2.5,1/28/2016 8:00,2016,1,28,8,129,µg/m³,1 Hr,Valid
Beijing,PM2.5,1/28/2016 9:00,2016,1,28,9,124,µg/m³,1 Hr,Valid
Beijing,PM2.5,1/28/2016 10:00,2016,1,28,10,140,µg/m³,1 Hr,Valid
Beijing,PM2.5,1/28/2016 11:00,2016,1,28,11,140,µg/m³,1 Hr,Valid
Beijing,PM2.5,1/28/2016 12:00,2016,1,28,12,126,µg/m³,1 Hr,Valid
Beijing,PM2.5,1/28/2016 13:00,2016,1,28,13,95,µg/m³,1 Hr,Valid
Beijing,PM2.5,1/28/2016 14:00,2016,1,28,14,80,µg/m³,1 Hr,Valid
Beijing,PM2.5,1/28/2016 15:00,2016,1,28,15,74,µg/m³,1 Hr,Valid
Beijing,PM2.5,1/28/2016 16:00,2016,1,28,16,71,µg/m³,1 Hr,Valid
Beijing,PM2.5,1/28/2016 17:00,2016,1,28,17,64,µg/m³,1 Hr,Valid
Beijing,PM2.5,1/28/2016 18:00,2016,1,28,18,94,µg/m³,1 Hr,Valid
Beijing,PM2.5,1/28/2016 19:00,2016,1,28,19,121,µg/m³,1 Hr,Valid
Beijing,PM2.5,1/28/2016 20:00,2016,1,28,20,148,µg/m³,1 Hr,Valid
Beijing,PM2.5,1/28/2016 21:00,2016,1,28,21,184,µg/m³,1 Hr,Valid
Beijing,PM2.5,1/28/2016 22:00,2016,1,28,22,181,µg/m³,1 Hr,Valid
Beijing,PM2.5,1/28/2016 23:00,2016,1,28,23,104,µg/m³,1 Hr,Valid
Beijing,PM2.5,1/29/2016 0:00,2016,1,29,0,87,µg/m³,1 Hr,Valid
Beijing,PM2.5,1/29/2016 1:00,2016,1,29,1,82,µg/m³,1 Hr,Valid
Beijing,PM2.5,1/29/2016 2:00,2016,1,29,2,71,µg/m³,1 Hr,Valid
Beijing,PM2.5,1/29/2016 3:00,2016,1,29,3,57,µg/m³,1 Hr,Valid
Beijing,PM2.5,1/29/2016 4:00,2016,1,29,4,61,µg/m³,1 Hr,Valid
Beijing,PM2.5,1/29/2016 5:00,2016,1,29,5,63,µg/m³,1 Hr,Valid
Beijing,PM2.5,1/29/2016 6:00,2016,1,29,6,65,µg/m³,1 Hr,Valid
Beijing,PM2.5,1/29/2016 7:00,2016,1,29,7,70,µg/m³,1 Hr,Valid
Beijing,PM2.5,1/29/2016 8:00,2016,1,29,8,73,µg/m³,1 Hr,Valid
Beijing,PM2.5,1/29/2016 9:00,2016,1,29,9,76,µg/m³,1 Hr,Valid
Beijing,PM2.5,1/29/2016 10:00,2016,1,29,10,77,µg/m³,1 Hr,Valid
Beijing,PM2.5,1/29/2016 11:00,2016,1,29,11,70,µg/m³,1 Hr,Valid
Beijing,PM2.5,1/29/2016 12:00,2016,1,29,12,65,µg/m³,1 Hr,Valid
Beijing,PM2.5,1/29/2016 13:00,2016,1,29,13,50,µg/m³,1 Hr,Valid
Beijing,PM2.5,1/29/2016 14:00,2016,1,29,14,51,µg/m³,1 Hr,Valid
Beijing,PM2.5,1/29/2016 15:00,2016,1,29,15,45,µg/m³,1 Hr,Valid
Beijing,PM2.5,1/29/2016 16:00,2016,1,29,16,51,µg/m³,1 Hr,Valid
Beijing,PM2.5,1/29/2016 17:00,2016,1,29,17,49,µg/m³,1 Hr,Valid
Beijing,PM2.5,1/29/2016 18:00,2016,1,29,18,42,µg/m³,1 Hr,Valid
Beijing,PM2.5,1/29/2016 19:00,2016,1,29,19,50,µg/m³,1 Hr,Valid
Beijing,PM2.5,1/29/2016 20:00,2016,1,29,20,62,µg/m³,1 Hr,Valid
Beijing,PM2.5,1/29/2016 21:00,2016,1,29,21,53,µg/m³,1 Hr,Valid
Beijing,PM2.5,1/29/2016 22:00,2016,1,29,22,38,µg/m³,1 Hr,Valid
Beijing,PM2.5,1/29/2016 23:00,2016,1,29,23,39,µg/m³,1 Hr,Valid
Beijing,PM2.5,1/30/2016 0:00,2016,1,30,0,29,µg/m³,1 Hr,Valid
Beijing,PM2.5,1/30/2016 1:00,2016,1,30,1,37,µg/m³,1 Hr,Valid
Beijing,PM2.5,1/30/2016 2:00,2016,1,30,2,29,µg/m³,1 Hr,Valid
Beijing,PM2.5,1/30/2016 3:00,2016,1,30,3,33,µg/m³,1 Hr,Valid
Beijing,PM2.5,1/30/2016 4:00,2016,1,30,4,55,µg/m³,1 Hr,Valid
Beijing,PM2.5,1/30/2016 5:00,2016,1,30,5,104,µg/m³,1 Hr,Valid
Beijing,PM2.5,1/30/2016 6:00,2016,1,30,6,85,µg/m³,1 Hr,Valid
Beijing,PM2.5,1/30/2016 7:00,2016,1,30,7,115,µg/m³,1 Hr,Valid
Beijing,PM2.5,1/30/2016 8:00,2016,1,30,8,71,µg/m³,1 Hr,Valid
Beijing,PM2.5,1/30/2016 9:00,2016,1,30,9,47,µg/m³,1 Hr,Valid
Beijing,PM2.5,1/30/2016 10:00,2016,1,30,10,28,µg/m³,1 Hr,Valid
Beijing,PM2.5,1/30/2016 11:00,2016,1,30,11,25,µg/m³,1 Hr,Valid
Beijing,PM2.5,1/30/2016 12:00,2016,1,30,12,22,µg/m³,1 Hr,Valid
Beijing,PM2.5,1/30/2016 13:00,2016,1,30,13,30,µg/m³,1 Hr,Valid
Beijing,PM2.5,1/30/2016 14:00,2016,1,30,14,27,µg/m³,1 Hr,Valid
Beijing,PM2.5,1/30/2016 15:00,2016,1,30,15,32,µg/m³,1 Hr,Valid
Beijing,PM2.5,1/30/2016 16:00,2016,1,30,16,46,µg/m³,1 Hr,Valid
Beijing,PM2.5,1/30/2016 17:00,2016,1,30,17,49,µg/m³,1 Hr,Valid
Beijing,PM2.5,1/30/2016 18:00,2016,1,30,18,68,µg/m³,1 Hr,Valid
Beijing,PM2.5,1/30/2016 19:00,2016,1,30,19,99,µg/m³,1 Hr,Valid
Beijing,PM2.5,1/30/2016 20:00,2016,1,30,20,93,µg/m³,1 Hr,Valid
Beijing,PM2.5,1/30/2016 21:00,2016,1,30,21,16,µg/m³,1 Hr,Valid
Beijing,PM2.5,1/30/2016 22:00,2016,1,30,22,12,µg/m³,1 Hr,Valid
Beijing,PM2.5,1/30/2016 23:00,2016,1,30,23,18,µg/m³,1 Hr,Valid
Beijing,PM2.5,1/31/2016 0:00,2016,1,31,0,14,µg/m³,1 Hr,Valid
Beijing,PM2.5,1/31/2016 1:00,2016,1,31,1,12,µg/m³,1 Hr,Valid
Beijing,PM2.5,1/31/2016 2:00,2016,1,31,2,13,µg/m³,1 Hr,Valid
Beijing,PM2.5,1/31/2016 3:00,2016,1,31,3,12,µg/m³,1 Hr,Valid
Beijing,PM2.5,1/31/2016 4:00,2016,1,31,4,10,µg/m³,1 Hr,Valid
Beijing,PM2.5,1/31/2016 5:00,2016,1,31,5,15,µg/m³,1 Hr,Valid
Beijing,PM2.5,1/31/2016 6:00,2016,1,31,6,8,µg/m³,1 Hr,Valid
Beijing,PM2.5,1/31/2016 7:00,2016,1,31,7,13,µg/m³,1 Hr,Valid
Beijing,PM2.5,1/31/2016 8:00,2016,1,31,8,12,µg/m³,1 Hr,Valid
Beijing,PM2.5,1/31/2016 9:00,2016,1,31,9,8,µg/m³,1 Hr,Valid
Beijing,PM2.5,1/31/2016 10:00,2016,1,31,10,16,µg/m³,1 Hr,Valid
Beijing,PM2.5,1/31/2016 11:00,2016,1,31,11,7,µg/m³,1 Hr,Valid
Beijing,PM2.5,1/31/2016 12:00,2016,1,31,12,10,µg/m³,1 Hr,Valid
Beijing,PM2.5,1/31/2016 13:00,2016,1,31,13,11,µg/m³,1 Hr,Valid
Beijing,PM2.5,1/31/2016 14:00,2016,1,31,14,10,µg/m³,1 Hr,Valid
Beijing,PM2.5,1/31/2016 15:00,2016,1,31,15,11,µg/m³,1 Hr,Valid
Beijing,PM2.5,1/31/2016 16:00,2016,1,31,16,11,µg/m³,1 Hr,Valid
Beijing,PM2.5,1/31/2016 17:00,2016,1,31,17,12,µg/m³,1 Hr,Valid
Beijing,PM2.5,1/31/2016 18:00,2016,1,31,18,13,µg/m³,1 Hr,Valid
Beijing,PM2.5,1/31/2016 19:00,2016,1,31,19,74,µg/m³,1 Hr,Valid
Beijing,PM2.5,1/31/2016 20:00,2016,1,31,20,16,µg/m³,1 Hr,Valid
Beijing,PM2.5,1/31/2016 21:00,2016,1,31,21,14,µg/m³,1 Hr,Valid
Beijing,PM2.5,1/31/2016 22:00,2016,1,31,22,11,µg/m³,1 Hr,Valid
Beijing,PM2.5,1/31/2016 23:00,2016,1,31,23,13,µg/m³,1 Hr,Valid
Beijing,PM2.5,2/1/2016 0:00,2016,2,1,0,11,µg/m³,1 Hr,Valid
Beijing,PM2.5,2/1/2016 1:00,2016,2,1,1,12,µg/m³,1 Hr,Valid
Beijing,PM2.5,2/1/2016 2:00,2016,2,1,2,15,µg/m³,1 Hr,Valid
Beijing,PM2.5,2/1/2016 3:00,2016,2,1,3,12,µg/m³,1 Hr,Valid
Beijing,PM2.5,2/1/2016 4:00,2016,2,1,4,13,µg/m³,1 Hr,Valid
Beijing,PM2.5,2/1/2016 5:00,2016,2,1,5,13,µg/m³,1 Hr,Valid
Beijing,PM2.5,2/1/2016 6:00,2016,2,1,6,25,µg/m³,1 Hr,Valid
Beijing,PM2.5,2/1/2016 7:00,2016,2,1,7,26,µg/m³,1 Hr,Valid
Beijing,PM2.5,2/1/2016 8:00,2016,2,1,8,34,µg/m³,1 Hr,Valid
Beijing,PM2.5,2/1/2016 9:00,2016,2,1,9,31,µg/m³,1 Hr,Valid
Beijing,PM2.5,2/1/2016 10:00,2016,2,1,10,14,µg/m³,1 Hr,Valid
Beijing,PM2.5,2/1/2016 11:00,2016,2,1,11,9,µg/m³,1 Hr,Valid
Beijing,PM2.5,2/1/2016 12:00,2016,2,1,12,11,µg/m³,1 Hr,Valid
Beijing,PM2.5,2/1/2016 13:00,2016,2,1,13,10,µg/m³,1 Hr,Valid
Beijing,PM2.5,2/1/2016 14:00,2016,2,1,14,8,µg/m³,1 Hr,Valid
Beijing,PM2.5,2/1/2016 15:00,2016,2,1,15,9,µg/m³,1 Hr,Valid
Beijing,PM2.5,2/1/2016 16:00,2016,2,1,16,9,µg/m³,1 Hr,Valid
Beijing,PM2.5,2/1/2016 17:00,2016,2,1,17,9,µg/m³,1 Hr,Valid
Beijing,PM2.5,2/1/2016 18:00,2016,2,1,18,17,µg/m³,1 Hr,Valid
Beijing,PM2.5,2/1/2016 19:00,2016,2,1,19,10,µg/m³,1 Hr,Valid
Beijing,PM2.5,2/1/2016 20:00,2016,2,1,20,10,µg/m³,1 Hr,Valid
Beijing,PM2.5,2/1/2016 21:00,2016,2,1,21,9,µg/m³,1 Hr,Valid
Beijing,PM2.5,2/1/2016 22:00,2016,2,1,22,10,µg/m³,1 Hr,Valid
Beijing,PM2.5,2/1/2016 23:00,2016,2,1,23,17,µg/m³,1 Hr,Valid
Beijing,PM2.5,2/2/2016 0:00,2016,2,2,0,10,µg/m³,1 Hr,Valid
Beijing,PM2.5,2/2/2016 1:00,2016,2,2,1,13,µg/m³,1 Hr,Valid
Beijing,PM2.5,2/2/2016 2:00,2016,2,2,2,18,µg/m³,1 Hr,Valid
Beijing,PM2.5,2/2/2016 3:00,2016,2,2,3,25,µg/m³,1 Hr,Valid
Beijing,PM2.5,2/2/2016 4:00,2016,2,2,4,20,µg/m³,1 Hr,Valid
Beijing,PM2.5,2/2/2016 5:00,2016,2,2,5,23,µg/m³,1 Hr,Valid
Beijing,PM2.5,2/2/2016 6:00,2016,2,2,6,25,µg/m³,1 Hr,Valid
Beijing,PM2.5,2/2/2016 7:00,2016,2,2,7,16,µg/m³,1 Hr,Valid
Beijing,PM2.5,2/2/2016 8:00,2016,2,2,8,12,µg/m³,1 Hr,Valid
Beijing,PM2.5,2/2/2016 9:00,2016,2,2,9,21,µg/m³,1 Hr,Valid
Beijing,PM2.5,2/2/2016 10:00,2016,2,2,10,23,µg/m³,1 Hr,Valid
Beijing,PM2.5,2/2/2016 11:00,2016,2,2,11,22,µg/m³,1 Hr,Valid
Beijing,PM2.5,2/2/2016 12:00,2016,2,2,12,25,µg/m³,1 Hr,Valid
Beijing,PM2.5,2/2/2016 13:00,2016,2,2,13,23,µg/m³,1 Hr,Valid
Beijing,PM2.5,2/2/2016 14:00,2016,2,2,14,16,µg/m³,1 Hr,Valid
Beijing,PM2.5,2/2/2016 15:00,2016,2,2,15,12,µg/m³,1 Hr,Valid
Beijing,PM2.5,2/2/2016 16:00,2016,2,2,16,11,µg/m³,1 Hr,Valid
Beijing,PM2.5,2/2/2016 17:00,2016,2,2,17,16,µg/m³,1 Hr,Valid
Beijing,PM2.5,2/2/2016 18:00,2016,2,2,18,57,µg/m³,1 Hr,Valid
Beijing,PM2.5,2/2/2016 19:00,2016,2,2,19,69,µg/m³,1 Hr,Valid
Beijing,PM2.5,2/2/2016 20:00,2016,2,2,20,69,µg/m³,1 Hr,Valid
Beijing,PM2.5,2/2/2016 21:00,2016,2,2,21,69,µg/m³,1 Hr,Valid
Beijing,PM2.5,2/2/2016 22:00,2016,2,2,22,29,µg/m³,1 Hr,Valid
Beijing,PM2.5,2/2/2016 23:00,2016,2,2,23,26,µg/m³,1 Hr,Valid
Beijing,PM2.5,2/3/2016 0:00,2016,2,3,0,37,µg/m³,1 Hr,Valid
Beijing,PM2.5,2/3/2016 1:00,2016,2,3,1,27,µg/m³,1 Hr,Valid
Beijing,PM2.5,2/3/2016 2:00,2016,2,3,2,33,µg/m³,1 Hr,Valid
Beijing,PM2.5,2/3/2016 3:00,2016,2,3,3,39,µg/m³,1 Hr,Valid
Beijing,PM2.5,2/3/2016 4:00,2016,2,3,4,27,µg/m³,1 Hr,Valid
Beijing,PM2.5,2/3/2016 5:00,2016,2,3,5,18,µg/m³,1 Hr,Valid
Beijing,PM2.5,2/3/2016 6:00,2016,2,3,6,29,µg/m³,1 Hr,Valid
Beijing,PM2.5,2/3/2016 7:00,2016,2,3,7,39,µg/m³,1 Hr,Valid
Beijing,PM2.5,2/3/2016 8:00,2016,2,3,8,30,µg/m³,1 Hr,Valid
Beijing,PM2.5,2/3/2016 9:00,2016,2,3,9,30,µg/m³,1 Hr,Valid
Beijing,PM2.5,2/3/2016 10:00,2016,2,3,10,38,µg/m³,1 Hr,Valid
Beijing,PM2.5,2/3/2016 11:00,2016,2,3,11,44,µg/m³,1 Hr,Valid
Beijing,PM2.5,2/3/2016 12:00,2016,2,3,12,56,µg/m³,1 Hr,Valid
Beijing,PM2.5,2/3/2016 13:00,2016,2,3,13,56,µg/m³,1 Hr,Valid
Beijing,PM2.5,2/3/2016 14:00,2016,2,3,14,50,µg/m³,1 Hr,Valid
Beijing,PM2.5,2/3/2016 15:00,2016,2,3,15,39,µg/m³,1 Hr,Valid
Beijing,PM2.5,2/3/2016 16:00,2016,2,3,16,36,µg/m³,1 Hr,Valid
Beijing,PM2.5,2/3/2016 17:00,2016,2,3,17,30,µg/m³,1 Hr,Valid
Beijing,PM2.5,2/3/2016 18:00,2016,2,3,18,56,µg/m³,1 Hr,Valid
Beijing,PM2.5,2/3/2016 19:00,2016,2,3,19,66,µg/m³,1 Hr,Valid
Beijing,PM2.5,2/3/2016 20:00,2016,2,3,20,46,µg/m³,1 Hr,Valid
Beijing,PM2.5,2/3/2016 21:00,2016,2,3,21,29,µg/m³,1 Hr,Valid
Beijing,PM2.5,2/3/2016 22:00,2016,2,3,22,22,µg/m³,1 Hr,Valid
Beijing,PM2.5,2/3/2016 23:00,2016,2,3,23,31,µg/m³,1 Hr,Valid
Beijing,PM2.5,2/4/2016 0:00,2016,2,4,0,43,µg/m³,1 Hr,Valid
Beijing,PM2.5,2/4/2016 1:00,2016,2,4,1,24,µg/m³,1 Hr,Valid
Beijing,PM2.5,2/4/2016 2:00,2016,2,4,2,14,µg/m³,1 Hr,Valid
Beijing,PM2.5,2/4/2016 3:00,2016,2,4,3,12,µg/m³,1 Hr,Valid
Beijing,PM2.5,2/4/2016 4:00,2016,2,4,4,10,µg/m³,1 Hr,Valid
Beijing,PM2.5,2/4/2016 5:00,2016,2,4,5,15,µg/m³,1 Hr,Valid
Beijing,PM2.5,2/4/2016 6:00,2016,2,4,6,14,µg/m³,1 Hr,Valid
Beijing,PM2.5,2/4/2016 7:00,2016,2,4,7,13,µg/m³,1 Hr,Valid
Beijing,PM2.5,2/4/2016 8:00,2016,2,4,8,12,µg/m³,1 Hr,Valid
Beijing,PM2.5,2/4/2016 9:00,2016,2,4,9,16,µg/m³,1 Hr,Valid
Beijing,PM2.5,2/4/2016 10:00,2016,2,4,10,18,µg/m³,1 Hr,Valid
Beijing,PM2.5,2/4/2016 11:00,2016,2,4,11,11,µg/m³,1 Hr,Valid
Beijing,PM2.5,2/4/2016 12:00,2016,2,4,12,12,µg/m³,1 Hr,Valid
Beijing,PM2.5,2/4/2016 13:00,2016,2,4,13,17,µg/m³,1 Hr,Valid
Beijing,PM2.5,2/4/2016 14:00,2016,2,4,14,11,µg/m³,1 Hr,Valid
Beijing,PM2.5,2/4/2016 15:00,2016,2,4,15,12,µg/m³,1 Hr,Valid
Beijing,PM2.5,2/4/2016 16:00,2016,2,4,16,16,µg/m³,1 Hr,Valid
Beijing,PM2.5,2/4/2016 17:00,2016,2,4,17,17,µg/m³,1 Hr,Valid
Beijing,PM2.5,2/4/2016 18:00,2016,2,4,18,12,µg/m³,1 Hr,Valid
Beijing,PM2.5,2/4/2016 19:00,2016,2,4,19,17,µg/m³,1 Hr,Valid
Beijing,PM2.5,2/4/2016 20:00,2016,2,4,20,10,µg/m³,1 Hr,Valid
Beijing,PM2.5,2/4/2016 21:00,2016,2,4,21,11,µg/m³,1 Hr,Valid
Beijing,PM2.5,2/4/2016 22:00,2016,2,4,22,17,µg/m³,1 Hr,Valid
Beijing,PM2.5,2/4/2016 23:00,2016,2,4,23,9,µg/m³,1 Hr,Valid
Beijing,PM2.5,2/5/2016 0:00,2016,2,5,0,12,µg/m³,1 Hr,Valid
Beijing,PM2.5,2/5/2016 1:00,2016,2,5,1,8,µg/m³,1 Hr,Valid
Beijing,PM2.5,2/5/2016 2:00,2016,2,5,2,10,µg/m³,1 Hr,Valid
Beijing,PM2.5,2/5/2016 3:00,2016,2,5,3,13,µg/m³,1 Hr,Valid
Beijing,PM2.5,2/5/2016 4:00,2016,2,5,4,9,µg/m³,1 Hr,Valid
Beijing,PM2.5,2/5/2016 5:00,2016,2,5,5,10,µg/m³,1 Hr,Valid
Beijing,PM2.5,2/5/2016 6:00,2016,2,5,6,13,µg/m³,1 Hr,Valid
Beijing,PM2.5,2/5/2016 7:00,2016,2,5,7,12,µg/m³,1 Hr,Valid
Beijing,PM2.5,2/5/2016 8:00,2016,2,5,8,10,µg/m³,1 Hr,Valid
Beijing,PM2.5,2/5/2016 9:00,2016,2,5,9,19,µg/m³,1 Hr,Valid
Beijing,PM2.5,2/5/2016 10:00,2016,2,5,10,9,µg/m³,1 Hr,Valid
Beijing,PM2.5,2/5/2016 11:00,2016,2,5,11,9,µg/m³,1 Hr,Valid
Beijing,PM2.5,2/5/2016 12:00,2016,2,5,12,14,µg/m³,1 Hr,Valid
Beijing,PM2.5,2/5/2016 13:00,2016,2,5,13,9,µg/m³,1 Hr,Valid
Beijing,PM2.5,2/5/2016 14:00,2016,2,5,14,10,µg/m³,1 Hr,Valid
Beijing,PM2.5,2/5/2016 15:00,2016,2,5,15,13,µg/m³,1 Hr,Valid
Beijing,PM2.5,2/5/2016 16:00,2016,2,5,16,8,µg/m³,1 Hr,Valid
Beijing,PM2.5,2/5/2016 17:00,2016,2,5,17,8,µg/m³,1 Hr,Valid
Beijing,PM2.5,2/5/2016 18:00,2016,2,5,18,8,µg/m³,1 Hr,Valid
Beijing,PM2.5,2/5/2016 19:00,2016,2,5,19,12,µg/m³,1 Hr,Valid
Beijing,PM2.5,2/5/2016 20:00,2016,2,5,20,17,µg/m³,1 Hr,Valid
Beijing,PM2.5,2/5/2016 21:00,2016,2,5,21,10,µg/m³,1 Hr,Valid
Beijing,PM2.5,2/5/2016 22:00,2016,2,5,22,10,µg/m³,1 Hr,Valid
Beijing,PM2.5,2/5/2016 23:00,2016,2,5,23,7,µg/m³,1 Hr,Valid
Beijing,PM2.5,2/6/2016 0:00,2016,2,6,0,8,µg/m³,1 Hr,Valid
Beijing,PM2.5,2/6/2016 1:00,2016,2,6,1,9,µg/m³,1 Hr,Valid
Beijing,PM2.5,2/6/2016 2:00,2016,2,6,2,9,µg/m³,1 Hr,Valid
Beijing,PM2.5,2/6/2016 3:00,2016,2,6,3,9,µg/m³,1 Hr,Valid
Beijing,PM2.5,2/6/2016 4:00,2016,2,6,4,16,µg/m³,1 Hr,Valid
Beijing,PM2.5,2/6/2016 5:00,2016,2,6,5,14,µg/m³,1 Hr,Valid
Beijing,PM2.5,2/6/2016 6:00,2016,2,6,6,24,µg/m³,1 Hr,Valid
Beijing,PM2.5,2/6/2016 7:00,2016,2,6,7,8,µg/m³,1 Hr,Valid
Beijing,PM2.5,2/6/2016 8:00,2016,2,6,8,18,µg/m³,1 Hr,Valid
Beijing,PM2.5,2/6/2016 9:00,2016,2,6,9,14,µg/m³,1 Hr,Valid
Beijing,PM2.5,2/6/2016 10:00,2016,2,6,10,15,µg/m³,1 Hr,Valid
Beijing,PM2.5,2/6/2016 11:00,2016,2,6,11,16,µg/m³,1 Hr,Valid
Beijing,PM2.5,2/6/2016 12:00,2016,2,6,12,42,µg/m³,1 Hr,Valid
Beijing,PM2.5,2/6/2016 13:00,2016,2,6,13,30,µg/m³,1 Hr,Valid
Beijing,PM2.5,2/6/2016 14:00,2016,2,6,14,27,µg/m³,1 Hr,Valid
Beijing,PM2.5,2/6/2016 15:00,2016,2,6,15,15,µg/m³,1 Hr,Valid
Beijing,PM2.5,2/6/2016 16:00,2016,2,6,16,9,µg/m³,1 Hr,Valid
Beijing,PM2.5,2/6/2016 17:00,2016,2,6,17,11,µg/m³,1 Hr,Valid
Beijing,PM2.5,2/6/2016 18:00,2016,2,6,18,49,µg/m³,1 Hr,Valid
Beijing,PM2.5,2/6/2016 19:00,2016,2,6,19,66,µg/m³,1 Hr,Valid
Beijing,PM2.5,2/6/2016 20:00,2016,2,6,20,66,µg/m³,1 Hr,Valid
Beijing,PM2.5,2/6/2016 21:00,2016,2,6,21,56,µg/m³,1 Hr,Valid
Beijing,PM2.5,2/6/2016 22:00,2016,2,6,22,79,µg/m³,1 Hr,Valid
Beijing,PM2.5,2/6/2016 23:00,2016,2,6,23,96,µg/m³,1 Hr,Valid
Beijing,PM2.5,2/7/2016 0:00,2016,2,7,0,84,µg/m³,1 Hr,Valid
Beijing,PM2.5,2/7/2016 1:00,2016,2,7,1,88,µg/m³,1 Hr,Valid
Beijing,PM2.5,2/7/2016 2:00,2016,2,7,2,93,µg/m³,1 Hr,Valid
Beijing,PM2.5,2/7/2016 3:00,2016,2,7,3,75,µg/m³,1 Hr,Valid
Beijing,PM2.5,2/7/2016 4:00,2016,2,7,4,57,µg/m³,1 Hr,Valid
Beijing,PM2.5,2/7/2016 5:00,2016,2,7,5,38,µg/m³,1 Hr,Valid
Beijing,PM2.5,2/7/2016 6:00,2016,2,7,6,33,µg/m³,1 Hr,Valid
Beijing,PM2.5,2/7/2016 7:00,2016,2,7,7,31,µg/m³,1 Hr,Valid
Beijing,PM2.5,2/7/2016 8:00,2016,2,7,8,56,µg/m³,1 Hr,Valid
Beijing,PM2.5,2/7/2016 9:00,2016,2,7,9,30,µg/m³,1 Hr,Valid
Beijing,PM2.5,2/7/2016 10:00,2016,2,7,10,36,µg/m³,1 Hr,Valid
Beijing,PM2.5,2/7/2016 11:00,2016,2,7,11,24,µg/m³,1 Hr,Valid
Beijing,PM2.5,2/7/2016 12:00,2016,2,7,12,19,µg/m³,1 Hr,Valid
Beijing,PM2.5,2/7/2016 13:00,2016,2,7,13,20,µg/m³,1 Hr,Valid
Beijing,PM2.5,2/7/2016 14:00,2016,2,7,14,20,µg/m³,1 Hr,Valid
Beijing,PM2.5,2/7/2016 15:00,2016,2,7,15,17,µg/m³,1 Hr,Valid
Beijing,PM2.5,2/7/2016 16:00,2016,2,7,16,20,µg/m³,1 Hr,Valid
Beijing,PM2.5,2/7/2016 17:00,2016,2,7,17,13,µg/m³,1 Hr,Valid
Beijing,PM2.5,2/7/2016 18:00,2016,2,7,18,20,µg/m³,1 Hr,Valid
Beijing,PM2.5,2/7/2016 19:00,2016,2,7,19,29,µg/m³,1 Hr,Valid
Beijing,PM2.5,2/7/2016 20:00,2016,2,7,20,60,µg/m³,1 Hr,Valid
Beijing,PM2.5,2/7/2016 21:00,2016,2,7,21,72,µg/m³,1 Hr,Valid
Beijing,PM2.5,2/7/2016 22:00,2016,2,7,22,103,µg/m³,1 Hr,Valid
Beijing,PM2.5,2/7/2016 23:00,2016,2,7,23,151,µg/m³,1 Hr,Valid
Beijing,PM2.5,2/8/2016 0:00,2016,2,8,0,-999,µg/m³,1 Hr,Missing
Beijing,PM2.5,2/8/2016 1:00,2016,2,8,1,544,µg/m³,1 Hr,Valid
Beijing,PM2.5,2/8/2016 2:00,2016,2,8,2,502,µg/m³,1 Hr,Valid
Beijing,PM2.5,2/8/2016 3:00,2016,2,8,3,-999,µg/m³,1 Hr,Missing
Beijing,PM2.5,2/8/2016 4:00,2016,2,8,4,601,µg/m³,1 Hr,Valid
Beijing,PM2.5,2/8/2016 5:00,2016,2,8,5,564,µg/m³,1 Hr,Valid
Beijing,PM2.5,2/8/2016 6:00,2016,2,8,6,562,µg/m³,1 Hr,Valid
Beijing,PM2.5,2/8/2016 7:00,2016,2,8,7,299,µg/m³,1 Hr,Valid
Beijing,PM2.5,2/8/2016 8:00,2016,2,8,8,21,µg/m³,1 Hr,Valid
Beijing,PM2.5,2/8/2016 9:00,2016,2,8,9,12,µg/m³,1 Hr,Valid
Beijing,PM2.5,2/8/2016 10:00,2016,2,8,10,13,µg/m³,1 Hr,Valid
Beijing,PM2.5,2/8/2016 11:00,2016,2,8,11,9,µg/m³,1 Hr,Valid
Beijing,PM2.5,2/8/2016 12:00,2016,2,8,12,14,µg/m³,1 Hr,Valid
Beijing,PM2.5,2/8/2016 13:00,2016,2,8,13,12,µg/m³,1 Hr,Valid
Beijing,PM2.5,2/8/2016 14:00,2016,2,8,14,10,µg/m³,1 Hr,Valid
Beijing,PM2.5,2/8/2016 15:00,2016,2,8,15,7,µg/m³,1 Hr,Valid
Beijing,PM2.5,2/8/2016 16:00,2016,2,8,16,6,µg/m³,1 Hr,Valid
Beijing,PM2.5,2/8/2016 17:00,2016,2,8,17,6,µg/m³,1 Hr,Valid
Beijing,PM2.5,2/8/2016 18:00,2016,2,8,18,11,µg/m³,1 Hr,Valid
Beijing,PM2.5,2/8/2016 19:00,2016,2,8,19,19,µg/m³,1 Hr,Valid
Beijing,PM2.5,2/8/2016 20:00,2016,2,8,20,64,µg/m³,1 Hr,Valid
Beijing,PM2.5,2/8/2016 21:00,2016,2,8,21,29,µg/m³,1 Hr,Valid
Beijing,PM2.5,2/8/2016 22:00,2016,2,8,22,28,µg/m³,1 Hr,Valid
Beijing,PM2.5,2/8/2016 23:00,2016,2,8,23,27,µg/m³,1 Hr,Valid
Beijing,PM2.5,2/9/2016 0:00,2016,2,9,0,23,µg/m³,1 Hr,Valid
Beijing,PM2.5,2/9/2016 1:00,2016,2,9,1,25,µg/m³,1 Hr,Valid
Beijing,PM2.5,2/9/2016 2:00,2016,2,9,2,29,µg/m³,1 Hr,Valid
Beijing,PM2.5,2/9/2016 3:00,2016,2,9,3,25,µg/m³,1 Hr,Valid
Beijing,PM2.5,2/9/2016 4:00,2016,2,9,4,28,µg/m³,1 Hr,Valid
Beijing,PM2.5,2/9/2016 5:00,2016,2,9,5,32,µg/m³,1 Hr,Valid
Beijing,PM2.5,2/9/2016 6:00,2016,2,9,6,26,µg/m³,1 Hr,Valid
Beijing,PM2.5,2/9/2016 7:00,2016,2,9,7,22,µg/m³,1 Hr,Valid
Beijing,PM2.5,2/9/2016 8:00,2016,2,9,8,20,µg/m³,1 Hr,Valid
Beijing,PM2.5,2/9/2016 9:00,2016,2,9,9,27,µg/m³,1 Hr,Valid
Beijing,PM2.5,2/9/2016 10:00,2016,2,9,10,31,µg/m³,1 Hr,Valid
Beijing,PM2.5,2/9/2016 11:00,2016,2,9,11,47,µg/m³,1 Hr,Valid
Beijing,PM2.5,2/9/2016 12:00,2016,2,9,12,56,µg/m³,1 Hr,Valid
Beijing,PM2.5,2/9/2016 13:00,2016,2,9,13,48,µg/m³,1 Hr,Valid
Beijing,PM2.5,2/9/2016 14:00,2016,2,9,14,41,µg/m³,1 Hr,Valid
Beijing,PM2.5,2/9/2016 15:00,2016,2,9,15,52,µg/m³,1 Hr,Valid
Beijing,PM2.5,2/9/2016 16:00,2016,2,9,16,63,µg/m³,1 Hr,Valid
Beijing,PM2.5,2/9/2016 17:00,2016,2,9,17,73,µg/m³,1 Hr,Valid
Beijing,PM2.5,2/9/2016 18:00,2016,2,9,18,78,µg/m³,1 Hr,Valid
Beijing,PM2.5,2/9/2016 19:00,2016,2,9,19,70,µg/m³,1 Hr,Valid
Beijing,PM2.5,2/9/2016 20:00,2016,2,9,20,71,µg/m³,1 Hr,Valid
Beijing,PM2.5,2/9/2016 21:00,2016,2,9,21,80,µg/m³,1 Hr,Valid
Beijing,PM2.5,2/9/2016 22:00,2016,2,9,22,69,µg/m³,1 Hr,Valid
Beijing,PM2.5,2/9/2016 23:00,2016,2,9,23,62,µg/m³,1 Hr,Valid
Beijing,PM2.5,2/10/2016 0:00,2016,2,10,0,98,µg/m³,1 Hr,Valid
Beijing,PM2.5,2/10/2016 1:00,2016,2,10,1,91,µg/m³,1 Hr,Valid
Beijing,PM2.5,2/10/2016 2:00,2016,2,10,2,94,µg/m³,1 Hr,Valid
Beijing,PM2.5,2/10/2016 3:00,2016,2,10,3,86,µg/m³,1 Hr,Valid
Beijing,PM2.5,2/10/2016 4:00,2016,2,10,4,79,µg/m³,1 Hr,Valid
Beijing,PM2.5,2/10/2016 5:00,2016,2,10,5,78,µg/m³,1 Hr,Valid
Beijing,PM2.5,2/10/2016 6:00,2016,2,10,6,97,µg/m³,1 Hr,Valid
Beijing,PM2.5,2/10/2016 7:00,2016,2,10,7,92,µg/m³,1 Hr,Valid
Beijing,PM2.5,2/10/2016 8:00,2016,2,10,8,110,µg/m³,1 Hr,Valid
Beijing,PM2.5,2/10/2016 9:00,2016,2,10,9,86,µg/m³,1 Hr,Valid
Beijing,PM2.5,2/10/2016 10:00,2016,2,10,10,71,µg/m³,1 Hr,Valid
Beijing,PM2.5,2/10/2016 11:00,2016,2,10,11,83,µg/m³,1 Hr,Valid
Beijing,PM2.5,2/10/2016 12:00,2016,2,10,12,93,µg/m³,1 Hr,Valid
Beijing,PM2.5,2/10/2016 13:00,2016,2,10,13,109,µg/m³,1 Hr,Valid
Beijing,PM2.5,2/10/2016 14:00,2016,2,10,14,115,µg/m³,1 Hr,Valid
Beijing,PM2.5,2/10/2016 15:00,2016,2,10,15,116,µg/m³,1 Hr,Valid
Beijing,PM2.5,2/10/2016 16:00,2016,2,10,16,119,µg/m³,1 Hr,Valid
Beijing,PM2.5,2/10/2016 17:00,2016,2,10,17,117,µg/m³,1 Hr,Valid
Beijing,PM2.5,2/10/2016 18:00,2016,2,10,18,121,µg/m³,1 Hr,Valid
Beijing,PM2.5,2/10/2016 19:00,2016,2,10,19,138,µg/m³,1 Hr,Valid
Beijing,PM2.5,2/10/2016 20:00,2016,2,10,20,177,µg/m³,1 Hr,Valid
Beijing,PM2.5,2/10/2016 21:00,2016,2,10,21,206,µg/m³,1 Hr,Valid
Beijing,PM2.5,2/10/2016 22:00,2016,2,10,22,217,µg/m³,1 Hr,Valid
Beijing,PM2.5,2/10/2016 23:00,2016,2,10,23,222,µg/m³,1 Hr,Valid
Beijing,PM2.5,2/11/2016 0:00,2016,2,11,0,227,µg/m³,1 Hr,Valid
Beijing,PM2.5,2/11/2016 1:00,2016,2,11,1,195,µg/m³,1 Hr,Valid
Beijing,PM2.5,2/11/2016 2:00,2016,2,11,2,180,µg/m³,1 Hr,Valid
Beijing,PM2.5,2/11/2016 3:00,2016,2,11,3,184,µg/m³,1 Hr,Valid
Beijing,PM2.5,2/11/2016 4:00,2016,2,11,4,186,µg/m³,1 Hr,Valid
Beijing,PM2.5,2/11/2016 5:00,2016,2,11,5,234,µg/m³,1 Hr,Valid
Beijing,PM2.5,2/11/2016 6:00,2016,2,11,6,230,µg/m³,1 Hr,Valid
Beijing,PM2.5,2/11/2016 7:00,2016,2,11,7,188,µg/m³,1 Hr,Valid
Beijing,PM2.5,2/11/2016 8:00,2016,2,11,8,154,µg/m³,1 Hr,Valid
Beijing,PM2.5,2/11/2016 9:00,2016,2,11,9,148,µg/m³,1 Hr,Valid
Beijing,PM2.5,2/11/2016 10:00,2016,2,11,10,164,µg/m³,1 Hr,Valid
Beijing,PM2.5,2/11/2016 11:00,2016,2,11,11,157,µg/m³,1 Hr,Valid
Beijing,PM2.5,2/11/2016 12:00,2016,2,11,12,157,µg/m³,1 Hr,Valid
Beijing,PM2.5,2/11/2016 13:00,2016,2,11,13,176,µg/m³,1 Hr,Valid
Beijing,PM2.5,2/11/2016 14:00,2016,2,11,14,172,µg/m³,1 Hr,Valid
Beijing,PM2.5,2/11/2016 15:00,2016,2,11,15,135,µg/m³,1 Hr,Valid
Beijing,PM2.5,2/11/2016 16:00,2016,2,11,16,129,µg/m³,1 Hr,Valid
Beijing,PM2.5,2/11/2016 17:00,2016,2,11,17,120,µg/m³,1 Hr,Valid
Beijing,PM2.5,2/11/2016 18:00,2016,2,11,18,122,µg/m³,1 Hr,Valid
Beijing,PM2.5,2/11/2016 19:00,2016,2,11,19,99,µg/m³,1 Hr,Valid
Beijing,PM2.5,2/11/2016 20:00,2016,2,11,20,89,µg/m³,1 Hr,Valid
Beijing,PM2.5,2/11/2016 21:00,2016,2,11,21,93,µg/m³,1 Hr,Valid
Beijing,PM2.5,2/11/2016 22:00,2016,2,11,22,95,µg/m³,1 Hr,Valid
Beijing,PM2.5,2/11/2016 23:00,2016,2,11,23,102,µg/m³,1 Hr,Valid
Beijing,PM2.5,2/12/2016 0:00,2016,2,12,0,114,µg/m³,1 Hr,Valid
Beijing,PM2.5,2/12/2016 1:00,2016,2,12,1,96,µg/m³,1 Hr,Valid
Beijing,PM2.5,2/12/2016 2:00,2016,2,12,2,106,µg/m³,1 Hr,Valid
Beijing,PM2.5,2/12/2016 3:00,2016,2,12,3,169,µg/m³,1 Hr,Valid
Beijing,PM2.5,2/12/2016 4:00,2016,2,12,4,171,µg/m³,1 Hr,Valid
Beijing,PM2.5,2/12/2016 5:00,2016,2,12,5,164,µg/m³,1 Hr,Valid
Beijing,PM2.5,2/12/2016 6:00,2016,2,12,6,145,µg/m³,1 Hr,Valid
Beijing,PM2.5,2/12/2016 7:00,2016,2,12,7,148,µg/m³,1 Hr,Valid
Beijing,PM2.5,2/12/2016 8:00,2016,2,12,8,143,µg/m³,1 Hr,Valid
Beijing,PM2.5,2/12/2016 9:00,2016,2,12,9,142,µg/m³,1 Hr,Valid
Beijing,PM2.5,2/12/2016 10:00,2016,2,12,10,145,µg/m³,1 Hr,Valid
Beijing,PM2.5,2/12/2016 11:00,2016,2,12,11,161,µg/m³,1 Hr,Valid
Beijing,PM2.5,2/12/2016 12:00,2016,2,12,12,171,µg/m³,1 Hr,Valid
Beijing,PM2.5,2/12/2016 13:00,2016,2,12,13,171,µg/m³,1 Hr,Valid
Beijing,PM2.5,2/12/2016 14:00,2016,2,12,14,161,µg/m³,1 Hr,Valid
Beijing,PM2.5,2/12/2016 15:00,2016,2,12,15,166,µg/m³,1 Hr,Valid
Beijing,PM2.5,2/12/2016 16:00,2016,2,12,16,176,µg/m³,1 Hr,Valid
Beijing,PM2.5,2/12/2016 17:00,2016,2,12,17,190,µg/m³,1 Hr,Valid
Beijing,PM2.5,2/12/2016 18:00,2016,2,12,18,186,µg/m³,1 Hr,Valid
Beijing,PM2.5,2/12/2016 19:00,2016,2,12,19,213,µg/m³,1 Hr,Valid
Beijing,PM2.5,2/12/2016 20:00,2016,2,12,20,194,µg/m³,1 Hr,Valid
Beijing,PM2.5,2/12/2016 21:00,2016,2,12,21,141,µg/m³,1 Hr,Valid
Beijing,PM2.5,2/12/2016 22:00,2016,2,12,22,41,µg/m³,1 Hr,Valid
Beijing,PM2.5,2/12/2016 23:00,2016,2,12,23,26,µg/m³,1 Hr,Valid
Beijing,PM2.5,2/13/2016 0:00,2016,2,13,0,18,µg/m³,1 Hr,Valid
Beijing,PM2.5,2/13/2016 1:00,2016,2,13,1,21,µg/m³,1 Hr,Valid
Beijing,PM2.5,2/13/2016 2:00,2016,2,13,2,16,µg/m³,1 Hr,Valid
Beijing,PM2.5,2/13/2016 3:00,2016,2,13,3,10,µg/m³,1 Hr,Valid
Beijing,PM2.5,2/13/2016 4:00,2016,2,13,4,14,µg/m³,1 Hr,Valid
Beijing,PM2.5,2/13/2016 5:00,2016,2,13,5,10,µg/m³,1 Hr,Valid
Beijing,PM2.5,2/13/2016 6:00,2016,2,13,6,7,µg/m³,1 Hr,Valid
Beijing,PM2.5,2/13/2016 7:00,2016,2,13,7,6,µg/m³,1 Hr,Valid
Beijing,PM2.5,2/13/2016 8:00,2016,2,13,8,7,µg/m³,1 Hr,Valid
Beijing,PM2.5,2/13/2016 9:00,2016,2,13,9,11,µg/m³,1 Hr,Valid
Beijing,PM2.5,2/13/2016 10:00,2016,2,13,10,9,µg/m³,1 Hr,Valid
Beijing,PM2.5,2/13/2016 11:00,2016,2,13,11,10,µg/m³,1 Hr,Valid
Beijing,PM2.5,2/13/2016 12:00,2016,2,13,12,6,µg/m³,1 Hr,Valid
Beijing,PM2.5,2/13/2016 13:00,2016,2,13,13,6,µg/m³,1 Hr,Valid
Beijing,PM2.5,2/13/2016 14:00,2016,2,13,14,6,µg/m³,1 Hr,Valid
Beijing,PM2.5,2/13/2016 15:00,2016,2,13,15,22,µg/m³,1 Hr,Valid
Beijing,PM2.5,2/13/2016 16:00,2016,2,13,16,25,µg/m³,1 Hr,Valid
Beijing,PM2.5,2/13/2016 17:00,2016,2,13,17,11,µg/m³,1 Hr,Valid
Beijing,PM2.5,2/13/2016 18:00,2016,2,13,18,9,µg/m³,1 Hr,Valid
Beijing,PM2.5,2/13/2016 19:00,2016,2,13,19,17,µg/m³,1 Hr,Valid
Beijing,PM2.5,2/13/2016 20:00,2016,2,13,20,11,µg/m³,1 Hr,Valid
Beijing,PM2.5,2/13/2016 21:00,2016,2,13,21,14,µg/m³,1 Hr,Valid
Beijing,PM2.5,2/13/2016 22:00,2016,2,13,22,15,µg/m³,1 Hr,Valid
Beijing,PM2.5,2/13/2016 23:00,2016,2,13,23,16,µg/m³,1 Hr,Valid
Beijing,PM2.5,2/14/2016 0:00,2016,2,14,0,7,µg/m³,1 Hr,Valid
Beijing,PM2.5,2/14/2016 1:00,2016,2,14,1,8,µg/m³,1 Hr,Valid
Beijing,PM2.5,2/14/2016 2:00,2016,2,14,2,8,µg/m³,1 Hr,Valid
Beijing,PM2.5,2/14/2016 3:00,2016,2,14,3,10,µg/m³,1 Hr,Valid
Beijing,PM2.5,2/14/2016 4:00,2016,2,14,4,6,µg/m³,1 Hr,Valid
Beijing,PM2.5,2/14/2016 5:00,2016,2,14,5,4,µg/m³,1 Hr,Valid
Beijing,PM2.5,2/14/2016 6:00,2016,2,14,6,5,µg/m³,1 Hr,Valid
Beijing,PM2.5,2/14/2016 7:00,2016,2,14,7,6,µg/m³,1 Hr,Valid
Beijing,PM2.5,2/14/2016 8:00,2016,2,14,8,11,µg/m³,1 Hr,Valid
Beijing,PM2.5,2/14/2016 9:00,2016,2,14,9,10,µg/m³,1 Hr,Valid
Beijing,PM2.5,2/14/2016 10:00,2016,2,14,10,11,µg/m³,1 Hr,Valid
Beijing,PM2.5,2/14/2016 11:00,2016,2,14,11,10,µg/m³,1 Hr,Valid
Beijing,PM2.5,2/14/2016 12:00,2016,2,14,12,8,µg/m³,1 Hr,Valid
Beijing,PM2.5,2/14/2016 13:00,2016,2,14,13,14,µg/m³,1 Hr,Valid
Beijing,PM2.5,2/14/2016 14:00,2016,2,14,14,8,µg/m³,1 Hr,Valid
Beijing,PM2.5,2/14/2016 15:00,2016,2,14,15,6,µg/m³,1 Hr,Valid
Beijing,PM2.5,2/14/2016 16:00,2016,2,14,16,6,µg/m³,1 Hr,Valid
Beijing,PM2.5,2/14/2016 17:00,2016,2,14,17,3,µg/m³,1 Hr,Valid
Beijing,PM2.5,2/14/2016 18:00,2016,2,14,18,3,µg/m³,1 Hr,Valid
Beijing,PM2.5,2/14/2016 19:00,2016,2,14,19,5,µg/m³,1 Hr,Valid
Beijing,PM2.5,2/14/2016 20:00,2016,2,14,20,7,µg/m³,1 Hr,Valid
Beijing,PM2.5,2/14/2016 21:00,2016,2,14,21,7,µg/m³,1 Hr,Valid
Beijing,PM2.5,2/14/2016 22:00,2016,2,14,22,7,µg/m³,1 Hr,Valid
Beijing,PM2.5,2/14/2016 23:00,2016,2,14,23,16,µg/m³,1 Hr,Valid
Beijing,PM2.5,2/15/2016 0:00,2016,2,15,0,4,µg/m³,1 Hr,Valid
Beijing,PM2.5,2/15/2016 1:00,2016,2,15,1,6,µg/m³,1 Hr,Valid
Beijing,PM2.5,2/15/2016 2:00,2016,2,15,2,7,µg/m³,1 Hr,Valid
Beijing,PM2.5,2/15/2016 3:00,2016,2,15,3,8,µg/m³,1 Hr,Valid
Beijing,PM2.5,2/15/2016 4:00,2016,2,15,4,8,µg/m³,1 Hr,Valid
Beijing,PM2.5,2/15/2016 5:00,2016,2,15,5,6,µg/m³,1 Hr,Valid
Beijing,PM2.5,2/15/2016 6:00,2016,2,15,6,11,µg/m³,1 Hr,Valid
Beijing,PM2.5,2/15/2016 7:00,2016,2,15,7,6,µg/m³,1 Hr,Valid
Beijing,PM2.5,2/15/2016 8:00,2016,2,15,8,6,µg/m³,1 Hr,Valid
Beijing,PM2.5,2/15/2016 9:00,2016,2,15,9,5,µg/m³,1 Hr,Valid
Beijing,PM2.5,2/15/2016 10:00,2016,2,15,10,7,µg/m³,1 Hr,Valid
Beijing,PM2.5,2/15/2016 11:00,2016,2,15,11,13,µg/m³,1 Hr,Valid
Beijing,PM2.5,2/15/2016 12:00,2016,2,15,12,11,µg/m³,1 Hr,Valid
Beijing,PM2.5,2/15/2016 13:00,2016,2,15,13,12,µg/m³,1 Hr,Valid
Beijing,PM2.5,2/15/2016 14:00,2016,2,15,14,8,µg/m³,1 Hr,Valid
Beijing,PM2.5,2/15/2016 15:00,2016,2,15,15,7,µg/m³,1 Hr,Valid
Beijing,PM2.5,2/15/2016 16:00,2016,2,15,16,11,µg/m³,1 Hr,Valid
Beijing,PM2.5,2/15/2016 17:00,2016,2,15,17,12,µg/m³,1 Hr,Valid
Beijing,PM2.5,2/15/2016 18:00,2016,2,15,18,11,µg/m³,1 Hr,Valid
Beijing,PM2.5,2/15/2016 19:00,2016,2,15,19,15,µg/m³,1 Hr,Valid
Beijing,PM2.5,2/15/2016 20:00,2016,2,15,20,12,µg/m³,1 Hr,Valid
Beijing,PM2.5,2/15/2016 21:00,2016,2,15,21,11,µg/m³,1 Hr,Valid
Beijing,PM2.5,2/15/2016 22:00,2016,2,15,22,9,µg/m³,1 Hr,Valid
Beijing,PM2.5,2/15/2016 23:00,2016,2,15,23,9,µg/m³,1 Hr,Valid
Beijing,PM2.5,2/16/2016 0:00,2016,2,16,0,17,µg/m³,1 Hr,Valid
Beijing,PM2.5,2/16/2016 1:00,2016,2,16,1,12,µg/m³,1 Hr,Valid
Beijing,PM2.5,2/16/2016 2:00,2016,2,16,2,12,µg/m³,1 Hr,Valid
Beijing,PM2.5,2/16/2016 3:00,2016,2,16,3,11,µg/m³,1 Hr,Valid
Beijing,PM2.5,2/16/2016 4:00,2016,2,16,4,8,µg/m³,1 Hr,Valid
Beijing,PM2.5,2/16/2016 5:00,2016,2,16,5,5,µg/m³,1 Hr,Valid
Beijing,PM2.5,2/16/2016 6:00,2016,2,16,6,4,µg/m³,1 Hr,Valid
Beijing,PM2.5,2/16/2016 7:00,2016,2,16,7,6,µg/m³,1 Hr,Valid
Beijing,PM2.5,2/16/2016 8:00,2016,2,16,8,6,µg/m³,1 Hr,Valid
Beijing,PM2.5,2/16/2016 9:00,2016,2,16,9,4,µg/m³,1 Hr,Valid
Beijing,PM2.5,2/16/2016 10:00,2016,2,16,10,2,µg/m³,1 Hr,Valid
Beijing,PM2.5,2/16/2016 11:00,2016,2,16,11,7,µg/m³,1 Hr,Valid
Beijing,PM2.5,2/16/2016 12:00,2016,2,16,12,8,µg/m³,1 Hr,Valid
Beijing,PM2.5,2/16/2016 13:00,2016,2,16,13,7,µg/m³,1 Hr,Valid
Beijing,PM2.5,2/16/2016 14:00,2016,2,16,14,6,µg/m³,1 Hr,Valid
Beijing,PM2.5,2/16/2016 15:00,2016,2,16,15,10,µg/m³,1 Hr,Valid
Beijing,PM2.5,2/16/2016 16:00,2016,2,16,16,11,µg/m³,1 Hr,Valid
Beijing,PM2.5,2/16/2016 17:00,2016,2,16,17,15,µg/m³,1 Hr,Valid
Beijing,PM2.5,2/16/2016 18:00,2016,2,16,18,19,µg/m³,1 Hr,Valid
Beijing,PM2.5,2/16/2016 19:00,2016,2,16,19,15,µg/m³,1 Hr,Valid
Beijing,PM2.5,2/16/2016 20:00,2016,2,16,20,19,µg/m³,1 Hr,Valid
Beijing,PM2.5,2/16/2016 21:00,2016,2,16,21,17,µg/m³,1 Hr,Valid
Beijing,PM2.5,2/16/2016 22:00,2016,2,16,22,16,µg/m³,1 Hr,Valid
Beijing,PM2.5,2/16/2016 23:00,2016,2,16,23,19,µg/m³,1 Hr,Valid
Beijing,PM2.5,2/17/2016 0:00,2016,2,17,0,17,µg/m³,1 Hr,Valid
Beijing,PM2.5,2/17/2016 1:00,2016,2,17,1,20,µg/m³,1 Hr,Valid
Beijing,PM2.5,2/17/2016 2:00,2016,2,17,2,20,µg/m³,1 Hr,Valid
Beijing,PM2.5,2/17/2016 3:00,2016,2,17,3,20,µg/m³,1 Hr,Valid
Beijing,PM2.5,2/17/2016 4:00,2016,2,17,4,23,µg/m³,1 Hr,Valid
Beijing,PM2.5,2/17/2016 5:00,2016,2,17,5,22,µg/m³,1 Hr,Valid
Beijing,PM2.5,2/17/2016 6:00,2016,2,17,6,36,µg/m³,1 Hr,Valid
Beijing,PM2.5,2/17/2016 7:00,2016,2,17,7,36,µg/m³,1 Hr,Valid
Beijing,PM2.5,2/17/2016 8:00,2016,2,17,8,55,µg/m³,1 Hr,Valid
Beijing,PM2.5,2/17/2016 9:00,2016,2,17,9,82,µg/m³,1 Hr,Valid
Beijing,PM2.5,2/17/2016 10:00,2016,2,17,10,80,µg/m³,1 Hr,Valid
Beijing,PM2.5,2/17/2016 11:00,2016,2,17,11,64,µg/m³,1 Hr,Valid
Beijing,PM2.5,2/17/2016 12:00,2016,2,17,12,48,µg/m³,1 Hr,Valid
Beijing,PM2.5,2/17/2016 13:00,2016,2,17,13,48,µg/m³,1 Hr,Valid
Beijing,PM2.5,2/17/2016 14:00,2016,2,17,14,44,µg/m³,1 Hr,Valid
Beijing,PM2.5,2/17/2016 15:00,2016,2,17,15,44,µg/m³,1 Hr,Valid
Beijing,PM2.5,2/17/2016 16:00,2016,2,17,16,41,µg/m³,1 Hr,Valid
Beijing,PM2.5,2/17/2016 17:00,2016,2,17,17,45,µg/m³,1 Hr,Valid
Beijing,PM2.5,2/17/2016 18:00,2016,2,17,18,47,µg/m³,1 Hr,Valid
Beijing,PM2.5,2/17/2016 19:00,2016,2,17,19,66,µg/m³,1 Hr,Valid
Beijing,PM2.5,2/17/2016 20:00,2016,2,17,20,59,µg/m³,1 Hr,Valid
Beijing,PM2.5,2/17/2016 21:00,2016,2,17,21,59,µg/m³,1 Hr,Valid
Beijing,PM2.5,2/17/2016 22:00,2016,2,17,22,73,µg/m³,1 Hr,Valid
Beijing,PM2.5,2/17/2016 23:00,2016,2,17,23,68,µg/m³,1 Hr,Valid
Beijing,PM2.5,2/18/2016 0:00,2016,2,18,0,20,µg/m³,1 Hr,Valid
Beijing,PM2.5,2/18/2016 1:00,2016,2,18,1,17,µg/m³,1 Hr,Valid
Beijing,PM2.5,2/18/2016 2:00,2016,2,18,2,16,µg/m³,1 Hr,Valid
Beijing,PM2.5,2/18/2016 3:00,2016,2,18,3,18,µg/m³,1 Hr,Valid
Beijing,PM2.5,2/18/2016 4:00,2016,2,18,4,13,µg/m³,1 Hr,Valid
Beijing,PM2.5,2/18/2016 5:00,2016,2,18,5,13,µg/m³,1 Hr,Valid
Beijing,PM2.5,2/18/2016 6:00,2016,2,18,6,7,µg/m³,1 Hr,Valid
Beijing,PM2.5,2/18/2016 7:00,2016,2,18,7,4,µg/m³,1 Hr,Valid
Beijing,PM2.5,2/18/2016 8:00,2016,2,18,8,8,µg/m³,1 Hr,Valid
Beijing,PM2.5,2/18/2016 9:00,2016,2,18,9,7,µg/m³,1 Hr,Valid
Beijing,PM2.5,2/18/2016 10:00,2016,2,18,10,9,µg/m³,1 Hr,Valid
Beijing,PM2.5,2/18/2016 11:00,2016,2,18,11,12,µg/m³,1 Hr,Valid
Beijing,PM2.5,2/18/2016 12:00,2016,2,18,12,7,µg/m³,1 Hr,Valid
Beijing,PM2.5,2/18/2016 13:00,2016,2,18,13,10,µg/m³,1 Hr,Valid
Beijing,PM2.5,2/18/2016 14:00,2016,2,18,14,7,µg/m³,1 Hr,Valid
Beijing,PM2.5,2/18/2016 15:00,2016,2,18,15,13,µg/m³,1 Hr,Valid
Beijing,PM2.5,2/18/2016 16:00,2016,2,18,16,12,µg/m³,1 Hr,Valid
Beijing,PM2.5,2/18/2016 17:00,2016,2,18,17,11,µg/m³,1 Hr,Valid
Beijing,PM2.5,2/18/2016 18:00,2016,2,18,18,16,µg/m³,1 Hr,Valid
Beijing,PM2.5,2/18/2016 19:00,2016,2,18,19,19,µg/m³,1 Hr,Valid
Beijing,PM2.5,2/18/2016 20:00,2016,2,18,20,40,µg/m³,1 Hr,Valid
Beijing,PM2.5,2/18/2016 21:00,2016,2,18,21,22,µg/m³,1 Hr,Valid
Beijing,PM2.5,2/18/2016 22:00,2016,2,18,22,21,µg/m³,1 Hr,Valid
Beijing,PM2.5,2/18/2016 23:00,2016,2,18,23,15,µg/m³,1 Hr,Valid
Beijing,PM2.5,2/19/2016 0:00,2016,2,19,0,20,µg/m³,1 Hr,Valid
Beijing,PM2.5,2/19/2016 1:00,2016,2,19,1,11,µg/m³,1 Hr,Valid
Beijing,PM2.5,2/19/2016 2:00,2016,2,19,2,20,µg/m³,1 Hr,Valid
Beijing,PM2.5,2/19/2016 3:00,2016,2,19,3,18,µg/m³,1 Hr,Valid
Beijing,PM2.5,2/19/2016 4:00,2016,2,19,4,18,µg/m³,1 Hr,Valid
Beijing,PM2.5,2/19/2016 5:00,2016,2,19,5,15,µg/m³,1 Hr,Valid
Beijing,PM2.5,2/19/2016 6:00,2016,2,19,6,32,µg/m³,1 Hr,Valid
Beijing,PM2.5,2/19/2016 7:00,2016,2,19,7,21,µg/m³,1 Hr,Valid
Beijing,PM2.5,2/19/2016 8:00,2016,2,19,8,21,µg/m³,1 Hr,Valid
Beijing,PM2.5,2/19/2016 9:00,2016,2,19,9,26,µg/m³,1 Hr,Valid
Beijing,PM2.5,2/19/2016 10:00,2016,2,19,10,25,µg/m³,1 Hr,Valid
Beijing,PM2.5,2/19/2016 11:00,2016,2,19,11,20,µg/m³,1 Hr,Valid
Beijing,PM2.5,2/19/2016 12:00,2016,2,19,12,20,µg/m³,1 Hr,Valid
Beijing,PM2.5,2/19/2016 13:00,2016,2,19,13,10,µg/m³,1 Hr,Valid
Beijing,PM2.5,2/19/2016 14:00,2016,2,19,14,10,µg/m³,1 Hr,Valid
Beijing,PM2.5,2/19/2016 15:00,2016,2,19,15,10,µg/m³,1 Hr,Valid
Beijing,PM2.5,2/19/2016 16:00,2016,2,19,16,6,µg/m³,1 Hr,Valid
Beijing,PM2.5,2/19/2016 17:00,2016,2,19,17,7,µg/m³,1 Hr,Valid
Beijing,PM2.5,2/19/2016 18:00,2016,2,19,18,14,µg/m³,1 Hr,Valid
Beijing,PM2.5,2/19/2016 19:00,2016,2,19,19,10,µg/m³,1 Hr,Valid
Beijing,PM2.5,2/19/2016 20:00,2016,2,19,20,9,µg/m³,1 Hr,Valid
Beijing,PM2.5,2/19/2016 21:00,2016,2,19,21,11,µg/m³,1 Hr,Valid
Beijing,PM2.5,2/19/2016 22:00,2016,2,19,22,6,µg/m³,1 Hr,Valid
Beijing,PM2.5,2/19/2016 23:00,2016,2,19,23,9,µg/m³,1 Hr,Valid
Beijing,PM2.5,2/20/2016 0:00,2016,2,20,0,10,µg/m³,1 Hr,Valid
Beijing,PM2.5,2/20/2016 1:00,2016,2,20,1,14,µg/m³,1 Hr,Valid
Beijing,PM2.5,2/20/2016 2:00,2016,2,20,2,9,µg/m³,1 Hr,Valid
Beijing,PM2.5,2/20/2016 3:00,2016,2,20,3,7,µg/m³,1 Hr,Valid
Beijing,PM2.5,2/20/2016 4:00,2016,2,20,4,7,µg/m³,1 Hr,Valid
Beijing,PM2.5,2/20/2016 5:00,2016,2,20,5,4,µg/m³,1 Hr,Valid
Beijing,PM2.5,2/20/2016 6:00,2016,2,20,6,5,µg/m³,1 Hr,Valid
Beijing,PM2.5,2/20/2016 7:00,2016,2,20,7,9,µg/m³,1 Hr,Valid
Beijing,PM2.5,2/20/2016 8:00,2016,2,20,8,6,µg/m³,1 Hr,Valid
Beijing,PM2.5,2/20/2016 9:00,2016,2,20,9,7,µg/m³,1 Hr,Valid
Beijing,PM2.5,2/20/2016 10:00,2016,2,20,10,10,µg/m³,1 Hr,Valid
Beijing,PM2.5,2/20/2016 11:00,2016,2,20,11,9,µg/m³,1 Hr,Valid
Beijing,PM2.5,2/20/2016 12:00,2016,2,20,12,8,µg/m³,1 Hr,Valid
Beijing,PM2.5,2/20/2016 13:00,2016,2,20,13,16,µg/m³,1 Hr,Valid
Beijing,PM2.5,2/20/2016 14:00,2016,2,20,14,19,µg/m³,1 Hr,Valid
Beijing,PM2.5,2/20/2016 15:00,2016,2,20,15,21,µg/m³,1 Hr,Valid
Beijing,PM2.5,2/20/2016 16:00,2016,2,20,16,16,µg/m³,1 Hr,Valid
Beijing,PM2.5,2/20/2016 17:00,2016,2,20,17,15,µg/m³,1 Hr,Valid
Beijing,PM2.5,2/20/2016 18:00,2016,2,20,18,12,µg/m³,1 Hr,Valid
Beijing,PM2.5,2/20/2016 19:00,2016,2,20,19,19,µg/m³,1 Hr,Valid
Beijing,PM2.5,2/20/2016 20:00,2016,2,20,20,24,µg/m³,1 Hr,Valid
Beijing,PM2.5,2/20/2016 21:00,2016,2,20,21,32,µg/m³,1 Hr,Valid
Beijing,PM2.5,2/20/2016 22:00,2016,2,20,22,39,µg/m³,1 Hr,Valid
Beijing,PM2.5,2/20/2016 23:00,2016,2,20,23,49,µg/m³,1 Hr,Valid
Beijing,PM2.5,2/21/2016 0:00,2016,2,21,0,64,µg/m³,1 Hr,Valid
Beijing,PM2.5,2/21/2016 1:00,2016,2,21,1,72,µg/m³,1 Hr,Valid
Beijing,PM2.5,2/21/2016 2:00,2016,2,21,2,71,µg/m³,1 Hr,Valid
Beijing,PM2.5,2/21/2016 3:00,2016,2,21,3,82,µg/m³,1 Hr,Valid
Beijing,PM2.5,2/21/2016 4:00,2016,2,21,4,81,µg/m³,1 Hr,Valid
Beijing,PM2.5,2/21/2016 5:00,2016,2,21,5,78,µg/m³,1 Hr,Valid
Beijing,PM2.5,2/21/2016 6:00,2016,2,21,6,83,µg/m³,1 Hr,Valid
Beijing,PM2.5,2/21/2016 7:00,2016,2,21,7,84,µg/m³,1 Hr,Valid
Beijing,PM2.5,2/21/2016 8:00,2016,2,21,8,55,µg/m³,1 Hr,Valid
Beijing,PM2.5,2/21/2016 9:00,2016,2,21,9,91,µg/m³,1 Hr,Valid
Beijing,PM2.5,2/21/2016 10:00,2016,2,21,10,141,µg/m³,1 Hr,Valid
Beijing,PM2.5,2/21/2016 11:00,2016,2,21,11,147,µg/m³,1 Hr,Valid
Beijing,PM2.5,2/21/2016 12:00,2016,2,21,12,97,µg/m³,1 Hr,Valid
Beijing,PM2.5,2/21/2016 13:00,2016,2,21,13,84,µg/m³,1 Hr,Valid
Beijing,PM2.5,2/21/2016 14:00,2016,2,21,14,83,µg/m³,1 Hr,Valid
Beijing,PM2.5,2/21/2016 15:00,2016,2,21,15,78,µg/m³,1 Hr,Valid
Beijing,PM2.5,2/21/2016 16:00,2016,2,21,16,79,µg/m³,1 Hr,Valid
Beijing,PM2.5,2/21/2016 17:00,2016,2,21,17,72,µg/m³,1 Hr,Valid
Beijing,PM2.5,2/21/2016 18:00,2016,2,21,18,85,µg/m³,1 Hr,Valid
Beijing,PM2.5,2/21/2016 19:00,2016,2,21,19,111,µg/m³,1 Hr,Valid
Beijing,PM2.5,2/21/2016 20:00,2016,2,21,20,122,µg/m³,1 Hr,Valid
Beijing,PM2.5,2/21/2016 21:00,2016,2,21,21,134,µg/m³,1 Hr,Valid
Beijing,PM2.5,2/21/2016 22:00,2016,2,21,22,114,µg/m³,1 Hr,Valid
Beijing,PM2.5,2/21/2016 23:00,2016,2,21,23,118,µg/m³,1 Hr,Valid
Beijing,PM2.5,2/22/2016 0:00,2016,2,22,0,132,µg/m³,1 Hr,Valid
Beijing,PM2.5,2/22/2016 1:00,2016,2,22,1,129,µg/m³,1 Hr,Valid
Beijing,PM2.5,2/22/2016 2:00,2016,2,22,2,119,µg/m³,1 Hr,Valid
Beijing,PM2.5,2/22/2016 3:00,2016,2,22,3,119,µg/m³,1 Hr,Valid
Beijing,PM2.5,2/22/2016 4:00,2016,2,22,4,113,µg/m³,1 Hr,Valid
Beijing,PM2.5,2/22/2016 5:00,2016,2,22,5,117,µg/m³,1 Hr,Valid
Beijing,PM2.5,2/22/2016 6:00,2016,2,22,6,122,µg/m³,1 Hr,Valid
Beijing,PM2.5,2/22/2016 7:00,2016,2,22,7,135,µg/m³,1 Hr,Valid
Beijing,PM2.5,2/22/2016 8:00,2016,2,22,8,143,µg/m³,1 Hr,Valid
Beijing,PM2.5,2/22/2016 9:00,2016,2,22,9,143,µg/m³,1 Hr,Valid
Beijing,PM2.5,2/22/2016 10:00,2016,2,22,10,116,µg/m³,1 Hr,Valid
Beijing,PM2.5,2/22/2016 11:00,2016,2,22,11,53,µg/m³,1 Hr,Valid
Beijing,PM2.5,2/22/2016 12:00,2016,2,22,12,15,µg/m³,1 Hr,Valid
Beijing,PM2.5,2/22/2016 13:00,2016,2,22,13,13,µg/m³,1 Hr,Valid
Beijing,PM2.5,2/22/2016 14:00,2016,2,22,14,11,µg/m³,1 Hr,Valid
Beijing,PM2.5,2/22/2016 15:00,2016,2,22,15,13,µg/m³,1 Hr,Valid
Beijing,PM2.5,2/22/2016 16:00,2016,2,22,16,10,µg/m³,1 Hr,Valid
Beijing,PM2.5,2/22/2016 17:00,2016,2,22,17,10,µg/m³,1 Hr,Valid
Beijing,PM2.5,2/22/2016 18:00,2016,2,22,18,8,µg/m³,1 Hr,Valid
Beijing,PM2.5,2/22/2016 19:00,2016,2,22,19,15,µg/m³,1 Hr,Valid
Beijing,PM2.5,2/22/2016 20:00,2016,2,22,20,35,µg/m³,1 Hr,Valid
Beijing,PM2.5,2/22/2016 21:00,2016,2,22,21,45,µg/m³,1 Hr,Valid
Beijing,PM2.5,2/22/2016 22:00,2016,2,22,22,32,µg/m³,1 Hr,Valid
Beijing,PM2.5,2/22/2016 23:00,2016,2,22,23,18,µg/m³,1 Hr,Valid
Beijing,PM2.5,2/23/2016 0:00,2016,2,23,0,18,µg/m³,1 Hr,Valid
Beijing,PM2.5,2/23/2016 1:00,2016,2,23,1,18,µg/m³,1 Hr,Valid
Beijing,PM2.5,2/23/2016 2:00,2016,2,23,2,17,µg/m³,1 Hr,Valid
Beijing,PM2.5,2/23/2016 3:00,2016,2,23,3,17,µg/m³,1 Hr,Valid
Beijing,PM2.5,2/23/2016 4:00,2016,2,23,4,10,µg/m³,1 Hr,Valid
Beijing,PM2.5,2/23/2016 5:00,2016,2,23,5,12,µg/m³,1 Hr,Valid
Beijing,PM2.5,2/23/2016 6:00,2016,2,23,6,12,µg/m³,1 Hr,Valid
Beijing,PM2.5,2/23/2016 7:00,2016,2,23,7,11,µg/m³,1 Hr,Valid
Beijing,PM2.5,2/23/2016 8:00,2016,2,23,8,8,µg/m³,1 Hr,Valid
Beijing,PM2.5,2/23/2016 9:00,2016,2,23,9,8,µg/m³,1 Hr,Valid
Beijing,PM2.5,2/23/2016 10:00,2016,2,23,10,12,µg/m³,1 Hr,Valid
Beijing,PM2.5,2/23/2016 11:00,2016,2,23,11,11,µg/m³,1 Hr,Valid
Beijing,PM2.5,2/23/2016 12:00,2016,2,23,12,11,µg/m³,1 Hr,Valid
Beijing,PM2.5,2/23/2016 13:00,2016,2,23,13,9,µg/m³,1 Hr,Valid
Beijing,PM2.5,2/23/2016 14:00,2016,2,23,14,9,µg/m³,1 Hr,Valid
Beijing,PM2.5,2/23/2016 15:00,2016,2,23,15,8,µg/m³,1 Hr,Valid
Beijing,PM2.5,2/23/2016 16:00,2016,2,23,16,6,µg/m³,1 Hr,Valid
Beijing,PM2.5,2/23/2016 17:00,2016,2,23,17,6,µg/m³,1 Hr,Valid
Beijing,PM2.5,2/23/2016 18:00,2016,2,23,18,10,µg/m³,1 Hr,Valid
Beijing,PM2.5,2/23/2016 19:00,2016,2,23,19,13,µg/m³,1 Hr,Valid
Beijing,PM2.5,2/23/2016 20:00,2016,2,23,20,36,µg/m³,1 Hr,Valid
Beijing,PM2.5,2/23/2016 21:00,2016,2,23,21,18,µg/m³,1 Hr,Valid
Beijing,PM2.5,2/23/2016 22:00,2016,2,23,22,21,µg/m³,1 Hr,Valid
Beijing,PM2.5,2/23/2016 23:00,2016,2,23,23,20,µg/m³,1 Hr,Valid
Beijing,PM2.5,2/24/2016 0:00,2016,2,24,0,19,µg/m³,1 Hr,Valid
Beijing,PM2.5,2/24/2016 1:00,2016,2,24,1,18,µg/m³,1 Hr,Valid
Beijing,PM2.5,2/24/2016 2:00,2016,2,24,2,15,µg/m³,1 Hr,Valid
Beijing,PM2.5,2/24/2016 3:00,2016,2,24,3,27,µg/m³,1 Hr,Valid
Beijing,PM2.5,2/24/2016 4:00,2016,2,24,4,44,µg/m³,1 Hr,Valid
Beijing,PM2.5,2/24/2016 5:00,2016,2,24,5,45,µg/m³,1 Hr,Valid
Beijing,PM2.5,2/24/2016 6:00,2016,2,24,6,37,µg/m³,1 Hr,Valid
Beijing,PM2.5,2/24/2016 7:00,2016,2,24,7,35,µg/m³,1 Hr,Valid
Beijing,PM2.5,2/24/2016 8:00,2016,2,24,8,27,µg/m³,1 Hr,Valid
Beijing,PM2.5,2/24/2016 9:00,2016,2,24,9,42,µg/m³,1 Hr,Valid
Beijing,PM2.5,2/24/2016 10:00,2016,2,24,10,58,µg/m³,1 Hr,Valid
Beijing,PM2.5,2/24/2016 11:00,2016,2,24,11,64,µg/m³,1 Hr,Valid
Beijing,PM2.5,2/24/2016 12:00,2016,2,24,12,31,µg/m³,1 Hr,Valid
Beijing,PM2.5,2/24/2016 13:00,2016,2,24,13,20,µg/m³,1 Hr,Valid
Beijing,PM2.5,2/24/2016 14:00,2016,2,24,14,24,µg/m³,1 Hr,Valid
Beijing,PM2.5,2/24/2016 15:00,2016,2,24,15,20,µg/m³,1 Hr,Valid
Beijing,PM2.5,2/24/2016 16:00,2016,2,24,16,27,µg/m³,1 Hr,Valid
Beijing,PM2.5,2/24/2016 17:00,2016,2,24,17,19,µg/m³,1 Hr,Valid
Beijing,PM2.5,2/24/2016 18:00,2016,2,24,18,11,µg/m³,1 Hr,Valid
Beijing,PM2.5,2/24/2016 19:00,2016,2,24,19,10,µg/m³,1 Hr,Valid
Beijing,PM2.5,2/24/2016 20:00,2016,2,24,20,7,µg/m³,1 Hr,Valid
Beijing,PM2.5,2/24/2016 21:00,2016,2,24,21,4,µg/m³,1 Hr,Valid
Beijing,PM2.5,2/24/2016 22:00,2016,2,24,22,5,µg/m³,1 Hr,Valid
Beijing,PM2.5,2/24/2016 23:00,2016,2,24,23,7,µg/m³,1 Hr,Valid
Beijing,PM2.5,2/25/2016 0:00,2016,2,25,0,16,µg/m³,1 Hr,Valid
Beijing,PM2.5,2/25/2016 1:00,2016,2,25,1,14,µg/m³,1 Hr,Valid
Beijing,PM2.5,2/25/2016 2:00,2016,2,25,2,17,µg/m³,1 Hr,Valid
Beijing,PM2.5,2/25/2016 3:00,2016,2,25,3,19,µg/m³,1 Hr,Valid
Beijing,PM2.5,2/25/2016 4:00,2016,2,25,4,27,µg/m³,1 Hr,Valid
Beijing,PM2.5,2/25/2016 5:00,2016,2,25,5,22,µg/m³,1 Hr,Valid
Beijing,PM2.5,2/25/2016 6:00,2016,2,25,6,22,µg/m³,1 Hr,Valid
Beijing,PM2.5,2/25/2016 7:00,2016,2,25,7,21,µg/m³,1 Hr,Valid
Beijing,PM2.5,2/25/2016 8:00,2016,2,25,8,18,µg/m³,1 Hr,Valid
Beijing,PM2.5,2/25/2016 9:00,2016,2,25,9,14,µg/m³,1 Hr,Valid
Beijing,PM2.5,2/25/2016 10:00,2016,2,25,10,21,µg/m³,1 Hr,Valid
Beijing,PM2.5,2/25/2016 11:00,2016,2,25,11,-999,µg/m³,1 Hr,Missing
Beijing,PM2.5,2/25/2016 12:00,2016,2,25,12,-999,µg/m³,1 Hr,Missing
Beijing,PM2.5,2/25/2016 13:00,2016,2,25,13,33,µg/m³,1 Hr,Valid
Beijing,PM2.5,2/25/2016 14:00,2016,2,25,14,34,µg/m³,1 Hr,Valid
Beijing,PM2.5,2/25/2016 15:00,2016,2,25,15,38,µg/m³,1 Hr,Valid
Beijing,PM2.5,2/25/2016 16:00,2016,2,25,16,43,µg/m³,1 Hr,Valid
Beijing,PM2.5,2/25/2016 17:00,2016,2,25,17,41,µg/m³,1 Hr,Valid
Beijing,PM2.5,2/25/2016 18:00,2016,2,25,18,21,µg/m³,1 Hr,Valid
Beijing,PM2.5,2/25/2016 19:00,2016,2,25,19,6,µg/m³,1 Hr,Valid
Beijing,PM2.5,2/25/2016 20:00,2016,2,25,20,13,µg/m³,1 Hr,Valid
Beijing,PM2.5,2/25/2016 21:00,2016,2,25,21,7,µg/m³,1 Hr,Valid
Beijing,PM2.5,2/25/2016 22:00,2016,2,25,22,1,µg/m³,1 Hr,Valid
Beijing,PM2.5,2/25/2016 23:00,2016,2,25,23,2,µg/m³,1 Hr,Valid
Beijing,PM2.5,2/26/2016 0:00,2016,2,26,0,5,µg/m³,1 Hr,Valid
Beijing,PM2.5,2/26/2016 1:00,2016,2,26,1,5,µg/m³,1 Hr,Valid
Beijing,PM2.5,2/26/2016 2:00,2016,2,26,2,5,µg/m³,1 Hr,Valid
Beijing,PM2.5,2/26/2016 3:00,2016,2,26,3,6,µg/m³,1 Hr,Valid
Beijing,PM2.5,2/26/2016 4:00,2016,2,26,4,5,µg/m³,1 Hr,Valid
Beijing,PM2.5,2/26/2016 5:00,2016,2,26,5,6,µg/m³,1 Hr,Valid
Beijing,PM2.5,2/26/2016 6:00,2016,2,26,6,9,µg/m³,1 Hr,Valid
Beijing,PM2.5,2/26/2016 7:00,2016,2,26,7,21,µg/m³,1 Hr,Valid
Beijing,PM2.5,2/26/2016 8:00,2016,2,26,8,28,µg/m³,1 Hr,Valid
Beijing,PM2.5,2/26/2016 9:00,2016,2,26,9,43,µg/m³,1 Hr,Valid
Beijing,PM2.5,2/26/2016 10:00,2016,2,26,10,39,µg/m³,1 Hr,Valid
Beijing,PM2.5,2/26/2016 11:00,2016,2,26,11,44,µg/m³,1 Hr,Valid
Beijing,PM2.5,2/26/2016 12:00,2016,2,26,12,44,µg/m³,1 Hr,Valid
Beijing,PM2.5,2/26/2016 13:00,2016,2,26,13,50,µg/m³,1 Hr,Valid
Beijing,PM2.5,2/26/2016 14:00,2016,2,26,14,43,µg/m³,1 Hr,Valid
Beijing,PM2.5,2/26/2016 15:00,2016,2,26,15,50,µg/m³,1 Hr,Valid
Beijing,PM2.5,2/26/2016 16:00,2016,2,26,16,48,µg/m³,1 Hr,Valid
Beijing,PM2.5,2/26/2016 17:00,2016,2,26,17,55,µg/m³,1 Hr,Valid
Beijing,PM2.5,2/26/2016 18:00,2016,2,26,18,55,µg/m³,1 Hr,Valid
Beijing,PM2.5,2/26/2016 19:00,2016,2,26,19,80,µg/m³,1 Hr,Valid
Beijing,PM2.5,2/26/2016 20:00,2016,2,26,20,100,µg/m³,1 Hr,Valid
Beijing,PM2.5,2/26/2016 21:00,2016,2,26,21,62,µg/m³,1 Hr,Valid
Beijing,PM2.5,2/26/2016 22:00,2016,2,26,22,28,µg/m³,1 Hr,Valid
Beijing,PM2.5,2/26/2016 23:00,2016,2,26,23,17,µg/m³,1 Hr,Valid
Beijing,PM2.5,2/27/2016 0:00,2016,2,27,0,12,µg/m³,1 Hr,Valid
Beijing,PM2.5,2/27/2016 1:00,2016,2,27,1,14,µg/m³,1 Hr,Valid
Beijing,PM2.5,2/27/2016 2:00,2016,2,27,2,8,µg/m³,1 Hr,Valid
Beijing,PM2.5,2/27/2016 3:00,2016,2,27,3,22,µg/m³,1 Hr,Valid
Beijing,PM2.5,2/27/2016 4:00,2016,2,27,4,17,µg/m³,1 Hr,Valid
Beijing,PM2.5,2/27/2016 5:00,2016,2,27,5,15,µg/m³,1 Hr,Valid
Beijing,PM2.5,2/27/2016 6:00,2016,2,27,6,19,µg/m³,1 Hr,Valid
Beijing,PM2.5,2/27/2016 7:00,2016,2,27,7,19,µg/m³,1 Hr,Valid
Beijing,PM2.5,2/27/2016 8:00,2016,2,27,8,19,µg/m³,1 Hr,Valid
Beijing,PM2.5,2/27/2016 9:00,2016,2,27,9,20,µg/m³,1 Hr,Valid
Beijing,PM2.5,2/27/2016 10:00,2016,2,27,10,19,µg/m³,1 Hr,Valid
Beijing,PM2.5,2/27/2016 11:00,2016,2,27,11,15,µg/m³,1 Hr,Valid
Beijing,PM2.5,2/27/2016 12:00,2016,2,27,12,18,µg/m³,1 Hr,Valid
Beijing,PM2.5,2/27/2016 13:00,2016,2,27,13,16,µg/m³,1 Hr,Valid
Beijing,PM2.5,2/27/2016 14:00,2016,2,27,14,18,µg/m³,1 Hr,Valid
Beijing,PM2.5,2/27/2016 15:00,2016,2,27,15,21,µg/m³,1 Hr,Valid
Beijing,PM2.5,2/27/2016 16:00,2016,2,27,16,29,µg/m³,1 Hr,Valid
Beijing,PM2.5,2/27/2016 17:00,2016,2,27,17,19,µg/m³,1 Hr,Valid
Beijing,PM2.5,2/27/2016 18:00,2016,2,27,18,30,µg/m³,1 Hr,Valid
Beijing,PM2.5,2/27/2016 19:00,2016,2,27,19,36,µg/m³,1 Hr,Valid
Beijing,PM2.5,2/27/2016 20:00,2016,2,27,20,53,µg/m³,1 Hr,Valid
Beijing,PM2.5,2/27/2016 21:00,2016,2,27,21,43,µg/m³,1 Hr,Valid
Beijing,PM2.5,2/27/2016 22:00,2016,2,27,22,27,µg/m³,1 Hr,Valid
Beijing,PM2.5,2/27/2016 23:00,2016,2,27,23,63,µg/m³,1 Hr,Valid
Beijing,PM2.5,2/28/2016 0:00,2016,2,28,0,54,µg/m³,1 Hr,Valid
Beijing,PM2.5,2/28/2016 1:00,2016,2,28,1,48,µg/m³,1 Hr,Valid
Beijing,PM2.5,2/28/2016 2:00,2016,2,28,2,54,µg/m³,1 Hr,Valid
Beijing,PM2.5,2/28/2016 3:00,2016,2,28,3,71,µg/m³,1 Hr,Valid
Beijing,PM2.5,2/28/2016 4:00,2016,2,28,4,63,µg/m³,1 Hr,Valid
Beijing,PM2.5,2/28/2016 5:00,2016,2,28,5,64,µg/m³,1 Hr,Valid
Beijing,PM2.5,2/28/2016 6:00,2016,2,28,6,63,µg/m³,1 Hr,Valid
Beijing,PM2.5,2/28/2016 7:00,2016,2,28,7,67,µg/m³,1 Hr,Valid
Beijing,PM2.5,2/28/2016 8:00,2016,2,28,8,74,µg/m³,1 Hr,Valid
Beijing,PM2.5,2/28/2016 9:00,2016,2,28,9,52,µg/m³,1 Hr,Valid
Beijing,PM2.5,2/28/2016 10:00,2016,2,28,10,31,µg/m³,1 Hr,Valid
Beijing,PM2.5,2/28/2016 11:00,2016,2,28,11,14,µg/m³,1 Hr,Valid
Beijing,PM2.5,2/28/2016 12:00,2016,2,28,12,12,µg/m³,1 Hr,Valid
Beijing,PM2.5,2/28/2016 13:00,2016,2,28,13,9,µg/m³,1 Hr,Valid
Beijing,PM2.5,2/28/2016 14:00,2016,2,28,14,10,µg/m³,1 Hr,Valid
Beijing,PM2.5,2/28/2016 15:00,2016,2,28,15,7,µg/m³,1 Hr,Valid
Beijing,PM2.5,2/28/2016 16:00,2016,2,28,16,7,µg/m³,1 Hr,Valid
Beijing,PM2.5,2/28/2016 17:00,2016,2,28,17,9,µg/m³,1 Hr,Valid
Beijing,PM2.5,2/28/2016 18:00,2016,2,28,18,9,µg/m³,1 Hr,Valid
Beijing,PM2.5,2/28/2016 19:00,2016,2,28,19,9,µg/m³,1 Hr,Valid
Beijing,PM2.5,2/28/2016 20:00,2016,2,28,20,13,µg/m³,1 Hr,Valid
Beijing,PM2.5,2/28/2016 21:00,2016,2,28,21,10,µg/m³,1 Hr,Valid
Beijing,PM2.5,2/28/2016 22:00,2016,2,28,22,7,µg/m³,1 Hr,Valid
Beijing,PM2.5,2/28/2016 23:00,2016,2,28,23,11,µg/m³,1 Hr,Valid
Beijing,PM2.5,2/29/2016 0:00,2016,2,29,0,14,µg/m³,1 Hr,Valid
Beijing,PM2.5,2/29/2016 1:00,2016,2,29,1,24,µg/m³,1 Hr,Valid
Beijing,PM2.5,2/29/2016 2:00,2016,2,29,2,19,µg/m³,1 Hr,Valid
Beijing,PM2.5,2/29/2016 3:00,2016,2,29,3,13,µg/m³,1 Hr,Valid
Beijing,PM2.5,2/29/2016 4:00,2016,2,29,4,29,µg/m³,1 Hr,Valid
Beijing,PM2.5,2/29/2016 5:00,2016,2,29,5,25,µg/m³,1 Hr,Valid
Beijing,PM2.5,2/29/2016 6:00,2016,2,29,6,12,µg/m³,1 Hr,Valid
Beijing,PM2.5,2/29/2016 7:00,2016,2,29,7,15,µg/m³,1 Hr,Valid
Beijing,PM2.5,2/29/2016 8:00,2016,2,29,8,12,µg/m³,1 Hr,Valid
Beijing,PM2.5,2/29/2016 9:00,2016,2,29,9,15,µg/m³,1 Hr,Valid
Beijing,PM2.5,2/29/2016 10:00,2016,2,29,10,20,µg/m³,1 Hr,Valid
Beijing,PM2.5,2/29/2016 11:00,2016,2,29,11,25,µg/m³,1 Hr,Valid
Beijing,PM2.5,2/29/2016 12:00,2016,2,29,12,30,µg/m³,1 Hr,Valid
Beijing,PM2.5,2/29/2016 13:00,2016,2,29,13,42,µg/m³,1 Hr,Valid
Beijing,PM2.5,2/29/2016 14:00,2016,2,29,14,44,µg/m³,1 Hr,Valid
Beijing,PM2.5,2/29/2016 15:00,2016,2,29,15,42,µg/m³,1 Hr,Valid
Beijing,PM2.5,2/29/2016 16:00,2016,2,29,16,51,µg/m³,1 Hr,Valid
Beijing,PM2.5,2/29/2016 17:00,2016,2,29,17,59,µg/m³,1 Hr,Valid
Beijing,PM2.5,2/29/2016 18:00,2016,2,29,18,52,µg/m³,1 Hr,Valid
Beijing,PM2.5,2/29/2016 19:00,2016,2,29,19,60,µg/m³,1 Hr,Valid
Beijing,PM2.5,2/29/2016 20:00,2016,2,29,20,62,µg/m³,1 Hr,Valid
Beijing,PM2.5,2/29/2016 21:00,2016,2,29,21,58,µg/m³,1 Hr,Valid
Beijing,PM2.5,2/29/2016 22:00,2016,2,29,22,57,µg/m³,1 Hr,Valid
Beijing,PM2.5,2/29/2016 23:00,2016,2,29,23,60,µg/m³,1 Hr,Valid
Beijing,PM2.5,3/1/2016 0:00,2016,3,1,0,85,µg/m³,1 Hr,Valid
Beijing,PM2.5,3/1/2016 1:00,2016,3,1,1,95,µg/m³,1 Hr,Valid
Beijing,PM2.5,3/1/2016 2:00,2016,3,1,2,105,µg/m³,1 Hr,Valid
Beijing,PM2.5,3/1/2016 3:00,2016,3,1,3,112,µg/m³,1 Hr,Valid
Beijing,PM2.5,3/1/2016 4:00,2016,3,1,4,124,µg/m³,1 Hr,Valid
Beijing,PM2.5,3/1/2016 5:00,2016,3,1,5,126,µg/m³,1 Hr,Valid
Beijing,PM2.5,3/1/2016 6:00,2016,3,1,6,132,µg/m³,1 Hr,Valid
Beijing,PM2.5,3/1/2016 7:00,2016,3,1,7,117,µg/m³,1 Hr,Valid
Beijing,PM2.5,3/1/2016 8:00,2016,3,1,8,116,µg/m³,1 Hr,Valid
Beijing,PM2.5,3/1/2016 9:00,2016,3,1,9,108,µg/m³,1 Hr,Valid
Beijing,PM2.5,3/1/2016 10:00,2016,3,1,10,105,µg/m³,1 Hr,Valid
Beijing,PM2.5,3/1/2016 11:00,2016,3,1,11,114,µg/m³,1 Hr,Valid
Beijing,PM2.5,3/1/2016 12:00,2016,3,1,12,126,µg/m³,1 Hr,Valid
Beijing,PM2.5,3/1/2016 13:00,2016,3,1,13,117,µg/m³,1 Hr,Valid
Beijing,PM2.5,3/1/2016 14:00,2016,3,1,14,112,µg/m³,1 Hr,Valid
Beijing,PM2.5,3/1/2016 15:00,2016,3,1,15,96,µg/m³,1 Hr,Valid
Beijing,PM2.5,3/1/2016 16:00,2016,3,1,16,111,µg/m³,1 Hr,Valid
Beijing,PM2.5,3/1/2016 17:00,2016,3,1,17,111,µg/m³,1 Hr,Valid
Beijing,PM2.5,3/1/2016 18:00,2016,3,1,18,138,µg/m³,1 Hr,Valid
Beijing,PM2.5,3/1/2016 19:00,2016,3,1,19,155,µg/m³,1 Hr,Valid
Beijing,PM2.5,3/1/2016 20:00,2016,3,1,20,178,µg/m³,1 Hr,Valid
Beijing,PM2.5,3/1/2016 21:00,2016,3,1,21,196,µg/m³,1 Hr,Valid
Beijing,PM2.5,3/1/2016 22:00,2016,3,1,22,202,µg/m³,1 Hr,Valid
Beijing,PM2.5,3/1/2016 23:00,2016,3,1,23,222,µg/m³,1 Hr,Valid
Beijing,PM2.5,3/2/2016 0:00,2016,3,2,0,220,µg/m³,1 Hr,Valid
Beijing,PM2.5,3/2/2016 1:00,2016,3,2,1,213,µg/m³,1 Hr,Valid
Beijing,PM2.5,3/2/2016 2:00,2016,3,2,2,228,µg/m³,1 Hr,Valid
Beijing,PM2.5,3/2/2016 3:00,2016,3,2,3,224,µg/m³,1 Hr,Valid
Beijing,PM2.5,3/2/2016 4:00,2016,3,2,4,239,µg/m³,1 Hr,Valid
Beijing,PM2.5,3/2/2016 5:00,2016,3,2,5,231,µg/m³,1 Hr,Valid
Beijing,PM2.5,3/2/2016 6:00,2016,3,2,6,219,µg/m³,1 Hr,Valid
Beijing,PM2.5,3/2/2016 7:00,2016,3,2,7,224,µg/m³,1 Hr,Valid
Beijing,PM2.5,3/2/2016 8:00,2016,3,2,8,198,µg/m³,1 Hr,Valid
Beijing,PM2.5,3/2/2016 9:00,2016,3,2,9,206,µg/m³,1 Hr,Valid
Beijing,PM2.5,3/2/2016 10:00,2016,3,2,10,194,µg/m³,1 Hr,Valid
Beijing,PM2.5,3/2/2016 11:00,2016,3,2,11,190,µg/m³,1 Hr,Valid
Beijing,PM2.5,3/2/2016 12:00,2016,3,2,12,168,µg/m³,1 Hr,Valid
Beijing,PM2.5,3/2/2016 13:00,2016,3,2,13,120,µg/m³,1 Hr,Valid
Beijing,PM2.5,3/2/2016 14:00,2016,3,2,14,76,µg/m³,1 Hr,Valid
Beijing,PM2.5,3/2/2016 15:00,2016,3,2,15,101,µg/m³,1 Hr,Valid
Beijing,PM2.5,3/2/2016 16:00,2016,3,2,16,112,µg/m³,1 Hr,Valid
Beijing,PM2.5,3/2/2016 17:00,2016,3,2,17,97,µg/m³,1 Hr,Valid
Beijing,PM2.5,3/2/2016 18:00,2016,3,2,18,107,µg/m³,1 Hr,Valid
Beijing,PM2.5,3/2/2016 19:00,2016,3,2,19,126,µg/m³,1 Hr,Valid
Beijing,PM2.5,3/2/2016 20:00,2016,3,2,20,158,µg/m³,1 Hr,Valid
Beijing,PM2.5,3/2/2016 21:00,2016,3,2,21,166,µg/m³,1 Hr,Valid
Beijing,PM2.5,3/2/2016 22:00,2016,3,2,22,186,µg/m³,1 Hr,Valid
Beijing,PM2.5,3/2/2016 23:00,2016,3,2,23,161,µg/m³,1 Hr,Valid
Beijing,PM2.5,3/3/2016 0:00,2016,3,3,0,135,µg/m³,1 Hr,Valid
Beijing,PM2.5,3/3/2016 1:00,2016,3,3,1,225,µg/m³,1 Hr,Valid
Beijing,PM2.5,3/3/2016 2:00,2016,3,3,2,275,µg/m³,1 Hr,Valid
Beijing,PM2.5,3/3/2016 3:00,2016,3,3,3,274,µg/m³,1 Hr,Valid
Beijing,PM2.5,3/3/2016 4:00,2016,3,3,4,281,µg/m³,1 Hr,Valid
Beijing,PM2.5,3/3/2016 5:00,2016,3,3,5,262,µg/m³,1 Hr,Valid
Beijing,PM2.5,3/3/2016 6:00,2016,3,3,6,248,µg/m³,1 Hr,Valid
Beijing,PM2.5,3/3/2016 7:00,2016,3,3,7,259,µg/m³,1 Hr,Valid
Beijing,PM2.5,3/3/2016 8:00,2016,3,3,8,278,µg/m³,1 Hr,Valid
Beijing,PM2.5,3/3/2016 9:00,2016,3,3,9,307,µg/m³,1 Hr,Valid
Beijing,PM2.5,3/3/2016 10:00,2016,3,3,10,316,µg/m³,1 Hr,Valid
Beijing,PM2.5,3/3/2016 11:00,2016,3,3,11,309,µg/m³,1 Hr,Valid
Beijing,PM2.5,3/3/2016 12:00,2016,3,3,12,332,µg/m³,1 Hr,Valid
Beijing,PM2.5,3/3/2016 13:00,2016,3,3,13,319,µg/m³,1 Hr,Valid
Beijing,PM2.5,3/3/2016 14:00,2016,3,3,14,314,µg/m³,1 Hr,Valid
Beijing,PM2.5,3/3/2016 15:00,2016,3,3,15,307,µg/m³,1 Hr,Valid
Beijing,PM2.5,3/3/2016 16:00,2016,3,3,16,299,µg/m³,1 Hr,Valid
Beijing,PM2.5,3/3/2016 17:00,2016,3,3,17,313,µg/m³,1 Hr,Valid
Beijing,PM2.5,3/3/2016 18:00,2016,3,3,18,348,µg/m³,1 Hr,Valid
Beijing,PM2.5,3/3/2016 19:00,2016,3,3,19,373,µg/m³,1 Hr,Valid
Beijing,PM2.5,3/3/2016 20:00,2016,3,3,20,377,µg/m³,1 Hr,Valid
Beijing,PM2.5,3/3/2016 21:00,2016,3,3,21,409,µg/m³,1 Hr,Valid
Beijing,PM2.5,3/3/2016 22:00,2016,3,3,22,427,µg/m³,1 Hr,Valid
Beijing,PM2.5,3/3/2016 23:00,2016,3,3,23,417,µg/m³,1 Hr,Valid
Beijing,PM2.5,3/4/2016 0:00,2016,3,4,0,414,µg/m³,1 Hr,Valid
Beijing,PM2.5,3/4/2016 1:00,2016,3,4,1,384,µg/m³,1 Hr,Valid
Beijing,PM2.5,3/4/2016 2:00,2016,3,4,2,336,µg/m³,1 Hr,Valid
Beijing,PM2.5,3/4/2016 3:00,2016,3,4,3,320,µg/m³,1 Hr,Valid
Beijing,PM2.5,3/4/2016 4:00,2016,3,4,4,318,µg/m³,1 Hr,Valid
Beijing,PM2.5,3/4/2016 5:00,2016,3,4,5,292,µg/m³,1 Hr,Valid
Beijing,PM2.5,3/4/2016 6:00,2016,3,4,6,294,µg/m³,1 Hr,Valid
Beijing,PM2.5,3/4/2016 7:00,2016,3,4,7,309,µg/m³,1 Hr,Valid
Beijing,PM2.5,3/4/2016 8:00,2016,3,4,8,303,µg/m³,1 Hr,Valid
Beijing,PM2.5,3/4/2016 9:00,2016,3,4,9,329,µg/m³,1 Hr,Valid
Beijing,PM2.5,3/4/2016 10:00,2016,3,4,10,357,µg/m³,1 Hr,Valid
Beijing,PM2.5,3/4/2016 11:00,2016,3,4,11,349,µg/m³,1 Hr,Valid
Beijing,PM2.5,3/4/2016 12:00,2016,3,4,12,364,µg/m³,1 Hr,Valid
Beijing,PM2.5,3/4/2016 13:00,2016,3,4,13,318,µg/m³,1 Hr,Valid
Beijing,PM2.5,3/4/2016 14:00,2016,3,4,14,308,µg/m³,1 Hr,Valid
Beijing,PM2.5,3/4/2016 15:00,2016,3,4,15,311,µg/m³,1 Hr,Valid
Beijing,PM2.5,3/4/2016 16:00,2016,3,4,16,307,µg/m³,1 Hr,Valid
Beijing,PM2.5,3/4/2016 17:00,2016,3,4,17,308,µg/m³,1 Hr,Valid
Beijing,PM2.5,3/4/2016 18:00,2016,3,4,18,357,µg/m³,1 Hr,Valid
Beijing,PM2.5,3/4/2016 19:00,2016,3,4,19,409,µg/m³,1 Hr,Valid
Beijing,PM2.5,3/4/2016 20:00,2016,3,4,20,347,µg/m³,1 Hr,Valid
Beijing,PM2.5,3/4/2016 21:00,2016,3,4,21,280,µg/m³,1 Hr,Valid
Beijing,PM2.5,3/4/2016 22:00,2016,3,4,22,110,µg/m³,1 Hr,Valid
Beijing,PM2.5,3/4/2016 23:00,2016,3,4,23,78,µg/m³,1 Hr,Valid
Beijing,PM2.5,3/5/2016 0:00,2016,3,5,0,139,µg/m³,1 Hr,Valid
Beijing,PM2.5,3/5/2016 1:00,2016,3,5,1,112,µg/m³,1 Hr,Valid
Beijing,PM2.5,3/5/2016 2:00,2016,3,5,2,80,µg/m³,1 Hr,Valid
Beijing,PM2.5,3/5/2016 3:00,2016,3,5,3,68,µg/m³,1 Hr,Valid
Beijing,PM2.5,3/5/2016 4:00,2016,3,5,4,70,µg/m³,1 Hr,Valid
Beijing,PM2.5,3/5/2016 5:00,2016,3,5,5,63,µg/m³,1 Hr,Valid
Beijing,PM2.5,3/5/2016 6:00,2016,3,5,6,59,µg/m³,1 Hr,Valid
Beijing,PM2.5,3/5/2016 7:00,2016,3,5,7,61,µg/m³,1 Hr,Valid
Beijing,PM2.5,3/5/2016 8:00,2016,3,5,8,55,µg/m³,1 Hr,Valid
Beijing,PM2.5,3/5/2016 9:00,2016,3,5,9,49,µg/m³,1 Hr,Valid
Beijing,PM2.5,3/5/2016 10:00,2016,3,5,10,54,µg/m³,1 Hr,Valid
Beijing,PM2.5,3/5/2016 11:00,2016,3,5,11,45,µg/m³,1 Hr,Valid
Beijing,PM2.5,3/5/2016 12:00,2016,3,5,12,50,µg/m³,1 Hr,Valid
Beijing,PM2.5,3/5/2016 13:00,2016,3,5,13,49,µg/m³,1 Hr,Valid
Beijing,PM2.5,3/5/2016 14:00,2016,3,5,14,49,µg/m³,1 Hr,Valid
Beijing,PM2.5,3/5/2016 15:00,2016,3,5,15,55,µg/m³,1 Hr,Valid
Beijing,PM2.5,3/5/2016 16:00,2016,3,5,16,58,µg/m³,1 Hr,Valid
Beijing,PM2.5,3/5/2016 17:00,2016,3,5,17,54,µg/m³,1 Hr,Valid
Beijing,PM2.5,3/5/2016 18:00,2016,3,5,18,52,µg/m³,1 Hr,Valid
Beijing,PM2.5,3/5/2016 19:00,2016,3,5,19,54,µg/m³,1 Hr,Valid
Beijing,PM2.5,3/5/2016 20:00,2016,3,5,20,58,µg/m³,1 Hr,Valid
Beijing,PM2.5,3/5/2016 21:00,2016,3,5,21,44,µg/m³,1 Hr,Valid
Beijing,PM2.5,3/5/2016 22:00,2016,3,5,22,76,µg/m³,1 Hr,Valid
Beijing,PM2.5,3/5/2016 23:00,2016,3,5,23,67,µg/m³,1 Hr,Valid
Beijing,PM2.5,3/6/2016 0:00,2016,3,6,0,55,µg/m³,1 Hr,Valid
Beijing,PM2.5,3/6/2016 1:00,2016,3,6,1,61,µg/m³,1 Hr,Valid
Beijing,PM2.5,3/6/2016 2:00,2016,3,6,2,70,µg/m³,1 Hr,Valid
Beijing,PM2.5,3/6/2016 3:00,2016,3,6,3,77,µg/m³,1 Hr,Valid
Beijing,PM2.5,3/6/2016 4:00,2016,3,6,4,68,µg/m³,1 Hr,Valid
Beijing,PM2.5,3/6/2016 5:00,2016,3,6,5,44,µg/m³,1 Hr,Valid
Beijing,PM2.5,3/6/2016 6:00,2016,3,6,6,32,µg/m³,1 Hr,Valid
Beijing,PM2.5,3/6/2016 7:00,2016,3,6,7,24,µg/m³,1 Hr,Valid
Beijing,PM2.5,3/6/2016 8:00,2016,3,6,8,26,µg/m³,1 Hr,Valid
Beijing,PM2.5,3/6/2016 9:00,2016,3,6,9,33,µg/m³,1 Hr,Valid
Beijing,PM2.5,3/6/2016 10:00,2016,3,6,10,57,µg/m³,1 Hr,Valid
Beijing,PM2.5,3/6/2016 11:00,2016,3,6,11,66,µg/m³,1 Hr,Valid
Beijing,PM2.5,3/6/2016 12:00,2016,3,6,12,98,µg/m³,1 Hr,Valid
Beijing,PM2.5,3/6/2016 13:00,2016,3,6,13,106,µg/m³,1 Hr,Valid
Beijing,PM2.5,3/6/2016 14:00,2016,3,6,14,119,µg/m³,1 Hr,Valid
Beijing,PM2.5,3/6/2016 15:00,2016,3,6,15,135,µg/m³,1 Hr,Valid
Beijing,PM2.5,3/6/2016 16:00,2016,3,6,16,134,µg/m³,1 Hr,Valid
Beijing,PM2.5,3/6/2016 17:00,2016,3,6,17,137,µg/m³,1 Hr,Valid
Beijing,PM2.5,3/6/2016 18:00,2016,3,6,18,146,µg/m³,1 Hr,Valid
Beijing,PM2.5,3/6/2016 19:00,2016,3,6,19,119,µg/m³,1 Hr,Valid
Beijing,PM2.5,3/6/2016 20:00,2016,3,6,20,110,µg/m³,1 Hr,Valid
Beijing,PM2.5,3/6/2016 21:00,2016,3,6,21,111,µg/m³,1 Hr,Valid
Beijing,PM2.5,3/6/2016 22:00,2016,3,6,22,124,µg/m³,1 Hr,Valid
Beijing,PM2.5,3/6/2016 23:00,2016,3,6,23,121,µg/m³,1 Hr,Valid
Beijing,PM2.5,3/7/2016 0:00,2016,3,7,0,132,µg/m³,1 Hr,Valid
Beijing,PM2.5,3/7/2016 1:00,2016,3,7,1,140,µg/m³,1 Hr,Valid
Beijing,PM2.5,3/7/2016 2:00,2016,3,7,2,147,µg/m³,1 Hr,Valid
Beijing,PM2.5,3/7/2016 3:00,2016,3,7,3,109,µg/m³,1 Hr,Valid
Beijing,PM2.5,3/7/2016 4:00,2016,3,7,4,81,µg/m³,1 Hr,Valid
Beijing,PM2.5,3/7/2016 5:00,2016,3,7,5,42,µg/m³,1 Hr,Valid
Beijing,PM2.5,3/7/2016 6:00,2016,3,7,6,17,µg/m³,1 Hr,Valid
